,Title,Author,Date,Text
10,‘Govt needs to return franchise tax to POGOs’,byRey E. Requejo,"May 4, 2023,","The Supreme Court (SC) has upheld its decision issued last year which declared as unconstitutional the government’s imposition of a 5% franchise tax on gross bets from gaming operations of the Philippine Offshore Gaming Operators (POGOs).
ADVERTISEMENT
In an eight-page resolution, the SC denied the motion for reconsideration filed by the Department of Finance (DOF) and the Bureau of Internal Revenue (BIR) seeking the reversal of the said ruling.
The high court directed the government to refund POGO licensees of the 5% franchise tax it collected from them under the Bayanihan 2 Law.
“It is evident that not to order a refund will result in injustice and inequity on the part of the POGO licensees. Thus, any amount that was collected from the POGO licensees based on the implementation of the Bayanihan 2 Law, and prior to the passage of R.A. 11590  (An Act Taxing Philippine Offshore Gaming Operations) should be returned,” the high court declared.
“All things considered, the Court finds no compelling reason to reverse and set aside the assailed decision. Thus, the motion for reconsideration must be denied with finality,” the SC said.
The SC also ordered that an entry of judgment be issued immediately in the case.
In its motion for reconsideration, the government through respondents DOF  and the BIR, argued that the assailed tax issuances are valid as these were issued on the account of the expanded licensing and regulatory authority of the Philippine Amusement and Gaming Corporation (Pagcor).
The said respondents maintained that offshore-based POGOs are subject to franchise tax and income taxes.
Furthermore, the DOF and BIR insisted that Sections 11 (f) and  ( g ) of the Bayanihan 2 Law are not riders.
 “After a judicious review of the allegations raised in the motion for reconsideration, the Court finds the same bereft of merit,” the SC ruled.
 It can be recalled that on September 29, 2022, the Court declared Section 11 (f)  and (g) of the Bayanihan 2 Law  ( An Act Providing for  Covid-19 Response and Recovery Intervention and Providing Mechanism to Accelerate the Recover and Bolster the Resiliency of the Philippine Economy, Providing Funds Therefor, and For Other Purposes ) as unconstitutional for being “riders.”   
ADVERTISEMENTThe decision stemmed from the petition for prohibition  filed by offshore-based gaming operators Saint Wealth Ltd., Marco Polo Enterprises Limited, MG Universal Link Limited,  OG Global Access Limited, Pride Fortune Limited, VIP Global Solutions Limited, AG Interpacific Resources Limited, Wanfang Technology Management Ltd.,  Imperial Choice Limited, Bestbetinnet Limited, Riesling Capital Limited,  Golden Dragon Empire Ltd., Oriental Game Limited, Most Success International Group Limited, and High Zone Capital Investment Group Limited, assailing the constitutional of the said provisions of Bayanihan 2 Law and related revenue issuances of respondents Department of Finance (DOF)  and the Bureau of Internal Revenue (BIR).
ADVERTISEMENT
Section 11 (f)  and (g) of the Bayanihan 2 Law   provides a list of sources of fund to address the Covid-19 pandemic which include the amounts derived from the five percent franchise tax on the gross bets from POGOs and income tax, value-added tax and other applicable taxes on income from non-gaming operations earned by POGO operators, agents, service providers and support providers.
In deciding the case, the high court pointed out that the said provisions  violate Section 26, Article VI of the Constitution which mandates that “every bill passed by the Congress shall embrace only one subject which shall be expressed in the title thereof.”
The SC noted  that the prohibition against riders “is to prevent hodge-podge or log-rolling legislation, and to ensure that all provisions of a statute have some reasonable relation to the subject matter as expressed in the title thereof.”
The tribunal noted that respondents – former  BIR Commissioner Caesar Dulay and Former Finance Secretary Carlos Dominguez III – even admitted that Bayanihan 2 Law is not a tax measure.
Thus, the Court held that the imposition of new taxes, “camouflaged as part of a long list of existing taxes, cannot be contemplated as an integral part of a temporary COVID-19 relief measure.
Consequently, the SC said BIR Revenue Regulation No. 30-2020, Revenue Memorandum Circular No. 64-2020, Revenue Memorandum Circular No. 102-2017 and Revenue Memorandum Circular 78-2018, in so far as they impose franchise tax, income tax and other applicable taxes on off-shore based POGOs, are “null and void for being contrary to the Constitution and other relevant laws.”
ADVERTISEMENT
"
11,Senate inclined to grant P1b for NAIA gensets,"byMacon Ramos-Araneta,Maricel Cruzand1 others","May 3, 2023,","Senators appeared to favorably consider a request by the Manila International Airport Authority (MIAA) for P1billion for the procurement of power generators to serve as power supply backup for the Ninoy Aquino International Airport (NAIA).
ADVERTISEMENT
Meanwhile, Batangas Rep. Ralph Recto sought a top-to-bottom checkup of the NAIA.
In a related development, the Manila Electric Co. (Meralco) asserted that deploying additional generator sets at the NAIA may not be the best idea to end the recurrent power outages at the country’s premier international airport.
Senate President Juan Miguel Zubiri said the government should provide the MIAA the funds needed by the airports.
“Kung anong pondo kailangan, dapat ibigay,” he stressed.
He said an airport is an essential  and strategic facility of the country.
Zubiri earlier asked Transportation Secretary Jaime Bautista for a “wish list” to be included in the 2024 budget.
Senate Finance committee chairman Juan Edgardo Angara said the Department of Budget and Management (DBM) should include the airport’s budget when they for inclusion in the proposed General Appropriations Act to be submitted to Malacanang.
Angara described the airports as a “crucial infrastructures.”
For her part, Senate public services committee chairperson Grace Poe said an extra P1- billion was necessary to provide backup power to the airports. She said this could be subsidized through the budget’s unprogrammed funds, or even through the revolving funds from airport operations.
“But the question is- if they knew that the existing backup power can only support 30 percent of the terminals’ power requirement, why did they not propose to procure back-up generators during our budget hearings last year? “ Poe inquired.
ADVERTISEMENT“Clearly, they have been remiss in their duties by not proposing an upgraded back-up system,” she pointed out.
ADVERTISEMENT
She recalled there was a full electrical audit conducted in 2017.
“We would like to know, what were the recommendations?” Poe said.
Why did past and present NAIA administrations fail to comply with the recommended upgrades,” she added.
In seeking the complete checkup of the NAIA, Recto cited the eight-hour power outage that struck facility last, May 1, causing the delay or cancelation of dozens of flights.
“According to the DOTr (Department of Transportation), the NAIA will undergo an electrical system audit. If there are many ailments, why not make it a complete check-up so that we’ll come up with the right cure?,” Recto said.
“And whatever work to be done should be submitted as one package, so the remedies will not be several Band Aid of cures, but a wellness package,” he added.
Recto added that the budget needed to upgrade the NAIA would not be a problem.
“So if the promised power system audit would validate that request, then government should buy it, but not necessarily in the amount floated. Panic buying is the number one procurement sin,” Recto stated.
“May pera naman kasi. NAIA is a corporate profit center for the government. It is not a charity,” he said.
“Even if this light bulb moment had come too late, after the airport had been hit with electrical crashes, it should be treated as an urgent request. Everytime the NAIA is hit with a blackout, the nation gets a black eye,” Recto stressed.
The gross revenues of the MIAA which runs the NAIA was P15.2 billion in 2019, Recto disclosed.
“Since the MIAA is a corporation, it need not seek appropriation authorization from Congress,” Recto noted.
He added Secretary Jimmy Bautista has the experience and the expertise “to undertake NAIA’s urgent to-do-list – the ones which are not cosmetic, but essential.”
For its part, Meralco said providing backup generators for the NAIA was viable.
‘We don’t think it’s the best option. Even if you have a genset and it’s your system that is electrically unsafe or underrated, there is still a chance of power failure. It’s a knee jerk reaction. They should talk to power systems experts,” a Meralco source said.
Meralco officials met with the DOTr on Wednesday for the conduct of an electrical audit, which the power retailer offered to conduct free of charge.
“We will conduct the electrical audit… as to the cause of the power outage last May 1, we reported that it was traced to the busted current transformers inside their own substation serving the parking areas,” the official said.
He said that when the transformer was re-energized around 3:46PM last May 1, it caused another total failure and when it was fully isolated, Terminal 3 went back to normal operations.
The Meralco official said the audit can be done in a couple of weeks, but what was important was implementing the audit findings.
He said Meralco wanted to work with Secretary Bautista, not only with the audit, but also on the needed upgrade or rectifications based on audit results.
“The rectifications may not cost that much,” he said.
Senator Sherwin Gatchalian said the May 1 airport brownout that hit NAIA Terminal 3 caused the cancellation of more than 40 flights, affecting thousands of travelers.
“This incident that happened was not acceptable. This disgusting event happened a few months after the entire air transport system was paralyzed during the New Year,” he said.
ADVERTISEMENT
“We should have learned our lessons from the New Year incident and appropriate redundancy measures should have been put into place to avoid a repeat of such incident,” Gatchalian said.
ADVERTISEMENT
"
12,CA bars opening of five roads in BF Parañaque to public,byRey E. Requejo,"May 3, 2023,","The Court of Appeals (CA) has sustained its earlier decision barring the opening of five gates of the BF Homes in Parañaque to the public.
ADVERTISEMENT
In a 14-page resolution, the CA’s Former Ninth Division denied the motion for reconsideration filed by respondents Human Settlements Adjudication Commission (HSAC) and several individuals seeking the reversal of its October 20, 2022 decision which overturned and set aside a ruling of the HSAC ordering the BF Federation of Homeowners’ Associations Inc. (BFFHAI) to open the gates and allow the entry of vehicles on Aguirre Avenue, Elizalde Street, El Grande Avenue, Concha Cruz Street and  Tropical Street in the BF Homes subdivisions, and to stop imposing entry fees on utility and delivery service providers.
In its appeal, the respondents assailed the CA’s decision as illegal as it amended a previous ruling of the appellate court issued on November 16, 1999 which upheld the local government of Paranaque’s reclassification of the El Grande Avenue and Aguirre Avenue as “commercial areas.”
They asserted that declaring the said roads as “commercial areas,” virtually made these thoroughfares public in nature.
Besides, the respondents maintained that the issuance of a writ of preliminary injunction by the HSAC to enjoin BFFHAI from requiring car stickers before allowing the entry of vehicles on the subject roads was justified.
They insisted that the subject roads should be opened because these are being maintained using public funds and that BFFHAI has no authority to sell car stickers.
But the CA held that El Grande and Aguirre avenues remained to be private properties despite their reclassification as commercial areas.
It noted that while the Supreme Court approved the reclassification of the El Grande and Aguirre avenues into commercial areas in a decision issued on February 7, 2007 it did not declare them as public roads.
“Needless to say, however, the reclassification does not automatically open the lands to public use,” the CA ruled.
The appellate court also upheld the authority of BFFHAI to regulate passage through subdivision and village roads under Section 10 (d) Republic Act 9904 or An Act Providing For A Magna Carta For Homeowners and Homeowners’ Association, and For Other Purposes.
The said provision states that an association has the right to “regulate access to, or passage through the subdivision/village roads for purposes of preserving privacy, tranquility, internal security, safety and traffic order.”
ADVERTISEMENT“The perceived inconvenience or moral suffering private respondents may suffer due to BFFHAI’s continuous implementation of the security measures is easily offset by the right of homeowners’ associations (including federations) to set goals for the promotion of safety and security, peace, comfort, and the general welfare of their residents…” the CA said.
ADVERTISEMENT
“BFFHAI has consistently explained that the fees collected are intended for the salary of their security guards, maintenance of the roads and payment of the real property taxes due,” it added.
The CA also noted that the respondents failed to present evidence to prove that public funds were used to maintain the roads in question.
“Besides, it bears underscoring that the homeowners of the BF Homes Subdivision are still residents of the cities of Parañaque, Las Piñas, and Muntinlupa, as the case may be. Unarguably, they are entitled to avail of the basic services offered by these local government units,” the Appellate Court emphasized.
ADVERTISEMENT
"
13,Poe seeks probe on Visayas power crisis; Zubiri favors EPIRA rewrite,byMacon Ramos-AranetaandAlena Mae S. Flores,"May 3, 2023,","Senator Grace Poe seeks an inquiry into the power outages plaguing Panay Island for years now to identify measures that would ensure continuous supply to consumers.
ADVERTISEMENT
Meanwhile, Senate President Juan Miguel Zubiri called on the Department of Energy (DOE) and the National Grid Corporation of the Philippines (NGCP) to solve the power crisis in the Visayas, even as he expressed openness to amend the EPIRA (Electric Power Industry Reform Act) if needed.
In another development, Aboitiz Power Corp. said it expected power supply to remain thin, but denied a possible power crisis even as demand continues to go up due to economic rebound.
Poe filed Senate Resolution No. 579, saying it is time to put in place a “long-term solution to the power woes which have been severely impacting on the daily lives of residents and economic activities in the region.”
“Recurring power interruptions and massive blackouts should not be a way of life for our people in Panay Island,” the chairperson of the Senate committee on public services said.
She said concerned agencies must get a handle on the problem to end the intolerable suffering of the residents.
Poe stressed the need to determine the root cause of the distribution problems reported by the National Grid Corporation of the Philippines (NGCP) allegedly due to the tripping of distribution utilities (DUs).
At the same time, the inquiry should delve into the position of electric cooperatives in Panay and Negros pointing to the NGCP as the cause of the problem, Poe said.
An electric cooperative cited a voltage fluctuation and frequency imbalance in the power lines under the management of the NGCP.
“There is an urgent need to determine the root of these grid disturbances, implement remedial measures and determine who shall be held liable to finally put an end to the blame-shifting between NGCP and the DUs, and ascertain possible franchise violations,” Poe said.
“There is also a need to look into the long-term solutions to the power interruptions and outages within the backdrop of the ‘thin’ supply of power in the Visayas grid,” she added.
ADVERTISEMENTZubiri said the DOE and the NGCP must step forward and answer to the consumers this massive blackouts.
ADVERTISEMENT
If they find the need to amend the EPIRA, Zubiri said they will tackle the amendment.
Since the EPIRA law is over two decades old, he said this can definitely be improved to help the power sector serve consumers better, and to help prevent recurring region-wide blackouts.
“We have received the administration’s suggested amendments to the EPIRA, and we are already studying these. We saw how these amendments can be further refined to best respond to the problems that we are hearing about from the power sector and especially from consumers.
But still, he said, the DOE and the NGCP must come forward with a clear explanation behind the blackouts, and more importantly, outline a solution.
“We cannot let this be the norm. Our people deserve better than this kind of service,” Zubiri said.
Zubiri noted that the power interruptions were “no longer just an inconvenience, but a major problem, affecting the economy and endangering the wellbeing of our people.”
Since late April, Zubiri said Western Visayas was hit by extensive blackouts, at the height of the summer season.
The blackouts, he said, have also led to many smaller businesses cutting down their operating hours.
In February, the region also suffered a power outage that lasted 10 hours, caused by a snake intrusion in the Panay Diesel Power Plant 1, according to the NGCP.
“The frequency of these blackouts is alarming, and it is on the DOE and the NGCP to get their act straight and find long-term solutions already,” said Zubiri
While few minutes of power interruption every once in a while is understandable, but frequent outages that last for hours and hours and cause loss of income is unforgivable.
“Let’s start with energy demand, it has bounced back quite significantly. In fact, we’re seeing record peaks in the last few weeks given the hot weather. Supply and demand margin remained thin,” Aboitiz Power president Emmanuel Rubio said in an interview with ANC.
Rubio said major capacities need to come in by 2024 and 2025 otherwise, supply will remain thin  but “I will not say it is a crisis.”
He said aside from thin supply, power costs remain an issue. “Although some plants that have been mothballed are running or going to run, so the question now would be how much will the power cost be?”
Rubio said, however, that once the Ilijan power plant comes online, which may be cheaper than diesel plants serving peak demand, there will be some improvements in terms of power rates.
“DoE is actually pursuing the investments, coming up with programs to allow investors to actually invest on RE [renewable energy] through GEAP [Green Energy Auction Program] and the deliveries are for 2024, 2025 and they’re quite significant capacity, all of these will help contribute to solve this short-term issue,” he said.
Rubio said liquefied petroleum gas was one of the options to address supply in the short to midterm although it is still expensive.
“Later on, there’s really no other option but to actually build LNG. We have land, that’s why we are actually doing the feasibility studies for our 1,200 MW LNG,” he said.
Rubio also said the proposed LNG plant can meet the base load supply requirement by 2028 to 2030.
Meanwhile, he said his company remains interested in nuclear energy particularly small nuclear reactors.
ADVERTISEMENT
“We are in continuous discussion with a number of SMR technology providers, I personally believe that SMRs will have a role to play in the Philippine energy setting,” he said.
ADVERTISEMENT
"
14,DOJ approves filing of 17 tax cases against QC-based publishing firm,byRey E. Requejo,"May 3, 2023,","The Department of Justice (DOJ) has approved the filing of 17 tax cases against the Quezon City-based Vibal Group, including its chief executive officer, for alleged violations of the National Internal Revenue Code (NIRC).
ADVERTISEMENT
The DOJ said it issued a resolution indicting Vibal Group, Inc., along with its CEO Kristine Mandigma, and controller Maricel Villas, for violation of Sections 254 (Attempt to Evade or Defeat Tax), and 255 (Failure to File Return, Supply Correct and Accurate Information, Pay Tax, Withhold and Remit Tax and Refund Excess Taxes Withheld on Compensation), in relation to Section 253(d) and Section 256 of the NIRC of 1997.
The DOJ said the cases will be filed before the Regional Trial Court in Quezon City.
The Vibal Group’s core businesses included publishing, printing, systems integration, and technology solutions specialized for education, government, and private enterprise.
“It was discovered that respondent did not pay withholding tax on compensation from March to September 2021, expanded withholding tax from January to September 2021 and final withholding tax on income for the period January to March 2021,” the DOJ said, citing the resolution rendered by the DOJ prosecutors.
“While Vibal group, Inc. filed its returns, it did not pay the taxes,” it added.
The DOJ noted that the Bureau of Internal Revenue sent a collection notice to Vibal Group with an attached list of returns filed without corresponding payments and demanded the immediate settlement of the taxes within ten days from the receipt.
But despite receipt of the documents, Vibal allegedly failed to pay the subject deficiency taxes as of January 3, 2023.
The DOJ said non-payment of the withholding taxes were all “willful and deliberate due to respondent’s act of repeated filing of various returns without payment.”
The DOJ prosecutors also pointed out that Mandigma and Villas were both liable for the cited violations having executed and signed the Statement of Management’s Responsibility for Annual Income Tax Return.
“In the said statement, they categorically admitted and owned responsibility for all information and representations contained in the annual income tax return and in all the other tax returns for the reporting period and affirmed the completeness and correctness in all material respects of respondent Vibal’s audited annual income tax return and financial statements for the year,” DOJ said, stressing that Mandigma and Villas were therefore, both responsible officers of the company.
ADVERTISEMENT
"
