,Title,Author,Date,Text
15,PH seeks duty-free rights in US,byVince LopezandMaricel Cruz,"May 5, 2023","Washington D.C.—President Ferdinand R. Marcos Jr. on Wednesday (Thursday, Manila time) called for the renewal of the Philippines’ participation in the US Generalized System of Preferences (GSP) trade program, which allowed the duty-free entry of several Philippine products into the United States.
ADVERTISEMENT
The country’s eligibility for the US GSP program expired on Dec. 31, 2020.
“We would like to request reauthorization… to boost trade and to make US products that are made in the Philippines more competitive,” Mr. Marcos said in a speech at a forum organized by the US-ASEAN BusinessCouncil and at a US Chamber of Commerce roundtable and reception at the Blair House in Washington DC.
The program, he said, would increase trade with the US and promote competition.
Aside from strengthening trade relations between the two countries, the President also called on US companies to invest more in the Philippines as the country has stepped up efforts to “create an atmosphere that is attractive to potential investors.”
He told American business executives that the Philippine economy grew 7.6 percent last year.
“This is the effect of our very aggressive efforts really to promote the Philippines as an investment destination,” Marcos said.
“We will never, at any point, say we got it perfected. We will continue to listen to you and to all our other partners as to what else we can do to help transform our economy and, in that way, to be able to play a viable part in the security and defense issues that are the challenges of the day and of the region.”
He noted that the US-Philippines alliance is in the “front and center right now,” overcoming “some bumps and scrapes” over the past years.
“But now, security and defense are top of mind… we also have to see that because our economies and our societies have grown more complex, everything… hinges on everything else and… it is very hard for us to separate and say that this is a discreet sector that does not affect any other sector,” he said.
Marcos also highlighted the government’s efforts to advance the digital transformation of the Philippines, particularly supporting the “smart industry readiness” of several semiconductor and electronics manufacturing services companies “to help them craft their digital transformation road maps.”
ADVERTISEMENTHe also told the American business leaders that Philippines has succeeded in streamlining the process for permits to ensure ease of doing business as he assured them that his administration is working hard to address red tape and the digitalization of bureaucratic processes.
ADVERTISEMENT
“They have done a very good job. They have reduced some of the permitting procedures from different industries from several months to a just few days,” he said.
“I am really confident that if its continued, if it can continue its work and if it is well supported by legislation, by the bureaucratic procedures, we can cut down many of those unnecessary regulatory documentary requirements,” he added.
The President said the country is also optimistic about the future increase in exports of solar and photovoltaic-related products from the Philippines as many countries strive to comply with their decarbonization targets.
He noted that with the trend toward electric vehicles, Philippine exports geared towards electric vehicle use, such as wire harnesses, rubber tires, and automotive electronics have good potential.
The semiconductor industry, on the other hand, can gain more from increasing skills in research and development, he said.
The President also assured American business leaders that the Philippines will “transform” and not just recover from the COVID-19 pandemic.
“I do not use the word recovery, I use the word transformation. Because we are not trying to recover to where we used to be. We are trying to transform ourselves to be part of the modern world,” Mr. Marcos said.
“Now, that transformation I think will occur and is a grand opportunity that we have been given. Now we do not start from a blank sheet of paper but it’s close [to that]. There are many new sectors that did not exist before. There are businesses that did not exist before that will be very dominant in the very near future,” the President added.
President Marcos said he does not want the Philippines to be back where it was in mid-2019, right before the pandemic hit.
“I want to be somewhere else. I want to be in the middle of the new economy, number one. I think that is important,” he said.
Present at the forum were top American businessmen and Filipino tycoons, among them Jaime Zobel de Ayala, Enrique Razon, Tessie Sy-Coson, and Kevin Tan.
Also on Wednesday, the President met with members of the US Senate to discuss a wide range of issues that include security, defense, agriculture, and climate change mitigation, economic cooperation and cybersecurity.
In his remarks, President Marcos thanked Sen. Robert Menendez, chairman of the Senate foreign relations committee and other members of the panel for welcoming his delegation to Capitol Hill for the frank and productive discussions on the state of Philippines-US relations.
Having been a member of the Philippine House of Representatives andthe Senate, Marcos said engagements between Manila and Washington should not only take place at the executive but also with members of the legislature.
Marcos noted that defense and security engagement remains the key pillar of Philippines-US bilateral relations. He hailed the US’ willingness to work with the Philippine government “as an equal, sovereign partner.”
The President also expressed the Philippines’ intention to deepen cooperation with the US in the areas of supply chain, health and health security, environment, energy security, and interconnectivity.
The meeting was part of the President’s official visit to Washington, and follows a series of high-level dialogues with US President Joseph Biden and US Vice President Kamala Harris.
Joining the President in the Wednesday Capitol Hill meeting were Speaker Ferdinand Martin Romualdez, Foreign Affairs Secretary Enrique A. Manalo, Philippine Ambassador to the US Jose Manuel G. Romualdez, Finance Secretary Benjamin Diokno, Justice Secretary Jesus Crispin C. Remulla, and Trade Secretary Alfredo Pascual.
Speaker Romualdez said the House is ready to take up the challenge of strengthening the long-standing relations between the Philippines and the United States through engagements of lawmakers of both countries.
“We, at the House of Representatives, welcome the suggestion of President Ferdinand R. Marcos, Jr. that efforts to boost the long-standing bond of friendship between the Philippines and the United States should also involve the respective legislative branches of the two countries,” Romualdez said.
ADVERTISEMENT
“We are ready to take up that challenge and we look forward to more engagements with our counterparts in the United States in the future,” he added.
ADVERTISEMENT
"
16,Do not meddle: China says SCS ’not hunting ground’ for outsiders,byManila Standard,"May 5, 2023","China has rejected what it described as “meddling” by outsiders in the South China Sea, saying it is “not a hunting ground” for forces outside of the region.
ADVERTISEMENT
Chinese foreign ministry spokesperson Mao Ning made the statement when asked to comment on the new defense guidelines betwee the Philippines and the US which includes how Washington will defend Manila if it came under attack in the SCS and areas within the Indo-Pacific region.
The official said concerted efforts of countries within the region allowed the situation in the South China Sea to maintain “overall stability.”
“The US-Philippines defense guidelines is a bilateral arrangement,” Mao said. “China firmly opposes any country’s move to meddle in the South China Sea issue to harm China’s territorial sovereignty and maritime rights and interests by citing the guidelines.”
Mao said the SCS is a “shared home for countries in the region, not a hunting ground for forces outside the region.”
“When regional countries are committed to mutual trust, solidarity, cooperation and properly handling differences, they have in their hand the key to peace and stability in the South China Sea,” Mao said.
Defense OIC Carlito Galvez and US Defense Secretary Lloyd Austin in Washington established the new guidelines to modernize bilateral alliance cooperation “for a free and open Indo-Pacific region.”
Under the guidelines, the Philippines and the US will expand cooperation on maritime security through but not limited to joint patrols.
The guidelines also “reaffirmed that an armed attack in the Pacific, including anywhere in the South China Sea, on either of their aircraft or armed forces – which includes their Coast Guards – would invoke mutual defense commitments under the 1951 PH-US Mutual Defense Treaty.”
“Recognizing that threats may arise in several domains—including land, sea, air, space, and cyberspace—and take the form of asymmetric, hybrid, and irregular warfare and gray-zone tactics, the guidelines chart a way forward to build interoperability in both conventional and non-conventional domains,” the fact sheet read.
ADVERTISEMENT
"
17,‘Golden Orb’ plan to secure King Charles’ coronation,byAFP,"May 5, 2023,","LONDON—Thousands of police officers, snipers, and cameras will be used this weekend to ensure King Charles III’s coronation passes off without incident.
ADVERTISEMENT
London’s Metropolitan police are spearheading a major security operation —dubbed “Golden Orb”—which will see officers redeployed from around the country to the capital.
The “multi-layered” plan will also feature officers from specialized units including dogs, firearms, and marine support. Police will also use facial recognition technology.
With world leaders and heads of state descending on London, as well as hundreds of thousands of expected visitors, the Met said the security operation would be “one of the most significant and largest” it had ever led.
Among those leaders is President Ferdinand Marcos Jr., who left the United States on Thursday (Friday, Manila time) with the First Family to attend the crowning of Britain’s 13th monarch since the political union of the kingdoms of England and Scotland.
The Marcos family’s trip, following the President’s five-day official visit to Washington, is in response to the invitation sent by the United Kingdom to Mr. Marcos as relayed by UK Ambassador Laure Beaufils.
In a statement, Malacañan Palace confirmed the President had accepted the invitation to attend the coronation of the new British sovereign. It was still unclear at press time who in the presidential entourage to the US would accompany the Marcoses to London as well.
The coronation will be held at Westminster Abbey on Saturday (Sunday in Manila), the Presidential Communications Office said.
The PCO said Mr. Marcos and the First Lady accepted the invitation of the Master of the Household, upon command of His Majesty, to a reception at Buckingham Palace on May 5 ahead of the coronation of King Charles and Her Majesty the Queen Consort, Camilla Parker-Bowles.
The President is also expected to meet with UK Prime Minister Rishi Sunak on Saturday.
“There will be more than 29,000 police officer deployments over the coming week in the lead up to Coronation Day and over the rest of the Bank Holiday weekend,” the force said in a statement.
ADVERTISEMENTSaturday will see the largest one-day mobilization of officers in decades, with just over 11,500 police on duty, including 2,500 specialist officers.
ADVERTISEMENT
They will line the processional route, manage crowds and road closures, protect high-profile guests, and carry out searches.
Anti-monarchy group Republic has announced its plans to protest what it calls the “vanity parade.” It is hoping around 1,000 people will turn out to boo the king as he passes Trafalgar Square.
The Met’s Deputy Assistant Commissioner Ade Adelekan told reporters Wednesday the planned demonstration would be “legal” but vowed “very swift action” if the protests became “criminal.”
“We have an extremely low threshold for anybody or anything that will disrupt this event,” he said.
Holding up an anti-monarchy sign is not a criminal act, Adelekan noted, while adding “our priority is around safety and security for everyone.”
Contentious new laws handing police increased powers to curb disruptive protests by climate campaigners and others came into force just this week, leading to accusations they were rushed through ahead of the coronation.
Under the new Public Order Act, protesters who block roads could face up to 12 months in prison.
The Met have also disclosed that they “intend to use facial recognition technology in central London.”
“The watch list will be focused on those whose attendance on Coronation Day would raise public protection concerns,” the force said. That includes those wanted for offenses or with outstanding arrest warrants, the statement added.
Civil liberties organisation Big Brother Watch hit out at the proposed use of what it branded an “authoritarian mass surveillance tool that turns the public into walking ID cards.”
“This Orwellian technology may be used in China and Russia but has no place on the streets of Britain…,” still less during the Coronation, its legal and policy officer Madeleine Stone said.
In addition, snipers will be stationed on some rooftops in central London, while the skies above the British capital will also be closely watched.
No drones or planes are permitted to fly over central London on Saturday, except for police helicopters and authorized media.
According to Philippine Ambassador to the UK Teodoro Locsin Jr., President Marcos personally knew King Charles during his early adulthood, and they even had a chance to play polo together.
Charles became king when his mother Queen Elizabeth II died last September 8. He also took over as head of state of 14 Commonwealth countries, including Australia, Canada, and New Zealand.
Charles Philip Arthur George chose his regnant name Charles III following his ascension to the throne. His mother Queen Elizabeth was the longest-reigning British monarch, which also made him the longest-serving Prince of Wales.
Mr. Sunak is eager to meet President Marcos at the coronation, Ambassador Beaufils said on Tuesday.
The British envoy said they were working on setting up a meeting between the two leaders on Saturday, the day of the coronation, but nothing had been finalized.
ADVERTISEMENT
“We hope so. The Prime Minister said that he would very much like to meet President Marcos so we’re in the process of trying to make that happen. We very much hope that the meeting will take place Saturday and we think it’s likely to take place on Saturday,” she added. With Vince Lopez
ADVERTISEMENT
"
18,"BuCor: Face mask, antigen test for visitors as COVID cases hike",byMacon Ramos-AranetaandMaricel Cruz,"May 5, 2023,","As COVID-19 is spreading anew, individuals visiting the offices of the Bureau of Corrections and the New Bilibid Prison are required to wear face masks and present negative rapid antigen test results.
ADVERTISEMENT
This comes amid the increase of COVID cases at the NBP and Correctional Institution for Women.
With the shift in testing protocols to focus more on symptomatic individuals, the Department of Health is bracing for a continuing rise in the COVID-19 positivity rate.
DOH Officer-in-Charge Dr. Maria Rosario Vergeire stressed that with this shift, those tested are most likely to be positive for the coronavirus disease.
Vergeire also said the positivity rate is not the sole criterion in monitoring the country’s COVID-19 situation.
She also allayed concerns from legislators on the reported increase in local COVID-19 cases.
During the hearing of the House Committee on Appropriations on the budgetary performance of the DOH, Vergeire told the panel the department is prevented from purchasing bivalent COVID-19 vaccines, which targets Omicron COVID-19 and its subvariants, due to an absence of a law authorizing such.
On the rising COVID cases, Vergeire said over 90 percent of the new infections being recorded daily are “mild and asymptomatic cases.”
“We’re averaging around 822 cases per day. This is about 79 percent higher than the previous two weeks of cases,” Vergeire told the House appropriations panel chaired by Ako Bicol Party-list Rep. Zaldy Co.
“Most of these cases are mild and asymptomatic cases. We will have about 8 to 9 percent of those with COVID that are classified as severe and critical,” she said.
Metro Manila’s weekly COVID-19 positivity rate rose to 19.7 percent as of May 2, according to pandemic monitor OCTA Research, as its fellow Dr. Guido David said Wednesday night the latest positivity rate increased by 7 points from 12.7 recorded on April 25.
ADVERTISEMENT“This could go as high as 25 percent,” he warned in a tweet on the positivity rate, or the percentage of tests turning out positive for the coronavirus. (See full story online at manilastandard.net)
ADVERTISEMENT
The World Health Organization recommends a 5-percent threshold for COVID-19 positivity rate.
Hospital occupancy in Metro Manila also increased to 24.7 percent on May 2 from 22.5 percent on April 25, Guido noted.
Infections surged in the past weeks due to increased mobility, waning immunity and more contagious COVID-19 variants, he told ABS-CBN News.
BuCor Health and Services Acting Director Dra. Ma. Cecilia Villanueva said that out of the 577 persons deprived of liberty (PDLs) tested this week, a total of 55 PDLs tested positive for the virus. Of this, 30 had mild symptoms while 22 were asymptomatic.
The agency said one Bucor personnel also tested positive for COVID-19, as the bureau said the first batch of 32 PDLs who tested positive must undergo a rapid antigen test on Friday before they can be discharged.
“We will continue to undertake contact tracing just to make sure that our personnel and PDLs are safe,” Villanueva said in a statement.
Visitation privileges, meanwhile, remain suspended.
“There are many factors or measures to consider as to an area’s increase in COVID-19 cases,” Vergeire said. “This means the metrics such as transmission rate, contact rate, and longer durations of infectiousness are not sole drivers of transmission and increases in cases.”
The DOH OIC said they must keep an eye on the healthcare utilization rates and monitor the situation on hospital admission.
She further cited the need to emphasize other factors such as layers of protection — mask wearing based on individual risk assessment, isolating when sick, and vaccination for the primary series and getting boosted.
Former National Task Force vs. COVID-19 adviser, public health expert Dr. Anthony Leachon, noted that while hospital occupancy remains low, it is increasing gradually. Although cases of COVID-19 infections are low, “we cannot predict the future,” he added.
He attributed the surge in the coronavirus cases to the new subvariant XBB 1.16 known as Arcturus, the wanning wall of immunity, the increase in mobility, complacency of people and the optional masking.
The WHO urged the public to make safe choices and assess the risk to help prevent infection as it acknowledged the rise in COVID-19 cases in the region.
If possible, WHO said, office meetings should be held online to protect oneself against coronavirus infection.
“When meeting in person, practice COVID-19 protective measures,” added WHO.
Meanwhile, Vergeire said that the absence of a law allowing the DOH to purchase bivalent Covid-19 vaccines explains why the DOH “is not very active” in pursuing the procurement of the vaccines.
Vergeire raised the issue upon a query from Marikina Rep. Stella Luz Quimbo, the House appropriations panel senior vice chairperson.
“Why is that we are not very active in procuring bivalent COVID-19 vaccines and we are depending on donation. As it is, our healthcare workers remain vulnerable because they are not yet protected,” Quimbo said.
In response, Vergeire said: “We just like to mention and emphasize that we did all things possible. Unfortunately, procurement is a non-option for us right now because of the existing laws in the country.”
“We don’t have a basis to do procurement as stated in provisions required by manufacturers for us to be able to enter agreements with them. We opted for donations at this point because we do not have a policy for us to go through the procurement process. The state of calamity was lifted, and because of that, our COVID-19 Vaccination law is already not valid,” she added.
Vergeire said the government has the money intended to purchase bivalent COVID-19 vaccines.
“We have a budget from our [COVID-19] loans, that is why we did not include it in the General Appropriations Act proposal,” she said.
ADVERTISEMENT
Quimbo, for her part, committed that Congress is ready to pass a law for the procurement of bivalent COVID-19 vaccines. “If there is a need to pass the law, the Congress is open to it, we will find ways to help you.”
ADVERTISEMENT
"
19,PBBM: Whole-of-gov’t fight vs. crimes,byVince Lopez,"May 5, 2023,","President Ferdinand Marcos Jr. has signed a memorandum circular directing all government agencies and encouraging local government units to support the 2023 National Crime Prevention Program (NCPP).
ADVERTISEMENT
The President said the directive is in line with the adoption of a “whole-of-government” approach in addressing criminality, and ensuring peace and security in the country.
The 2023 NCPP puts into practice the strategies for ensuring peace and security under the Philippine Development Plan 2023-2028 with the National Police Commission (Napolcom) at the helm of NCPP implementation.
The 2023 NCPP was developed by Napolcom through its Technical Committee on Crime Prevention and Criminal Justice, an inter-disciplinary body composed of acknowledged experts from government agencies and non-government organizations involved in the criminal justice system.
Napolcom is an agency attached to the Department of the Interior and Local Government (DILG) responsible for the administration and control of the Philippine National Police.
On Thursday, a ranking police official said the country’s crime rate dropped by 11.36 percent in the first three months of the year.
In a Laging Handa briefing, Philippine National Police (PNP) PublicInformation Office chief Col. Redrico Maranan said a total of 12,226 crime incidents were recorded from Jan. 1 to May 2, compared to 13,763 crimes in the same period last year.
“We were able to reduce 1,500 plus crimes of the so-called eight focus crimes. That’s why we see, our different anti-criminality strategies, we see that it is effective,” he added.
The eight focus crimes are murder, homicide, physical injury, robbery, theft, vehicle theft, motorcycle theft and rape.
Index crimes are serious crimes such as murder, homicide, physical injury, robbery, rape, theft, and carjacking, while non-index crimes are violations of local ordinances and laws and vehicular accidents.
Maranan said that under PNP chief Gen. Benjamin Acorda Jr.’s leadership, the PNP will deploy policemen in barangays identified by the local police forces as crime-prone areas as part of preemptive efforts against criminality. (See full story online at manilastandard.net)
ADVERTISEMENT“The focus of our new PNP chief, Gen. Acorda, is to assign police tocrime-prone barangays. We have already identified that and that will be the priority of our deployment… in the crime-prone barangays. And we have also identified police regional offices that will be the ones to lead in their area of responsibility,” he added.
ADVERTISEMENT
Maranan earlier said the move is a strategic action plan as the national police do not have enough manpower to guard over 100 million Filipinos across the country.
Maranan explained that police visibility has been proven as a crime deterrent over the years.
He emphasized the importance of the cooperation of the barangay officials in maintaining peace and order.
He said that strong coordination between the police and the community lies on the cooperation between the two, adding that it is the police commanders who are given the task to initiate it.
“The PNP cannot deploy policemen in each of the barangay. What we do is to cluster the barangay and then we either put up Police Community Precincts, police assistance desks or even a police outpost. We believe that if this is properly implemented, we would be able to reduce crime, especially in the crime-prone barangays,” he added.
ADVERTISEMENT
"
