,Title,Author,Date,Text
24,US trip yields over $1.1b in investment pledges,byVince LopezandOthel V. Campos,"May 4, 2023,","American companies—including those involved in pharmaceuticals, semiconductors, solar power and business process outsourcing–committed to invest more than $1.1 billion in the Philippines and told visiting President Ferdinand Marcos Jr. they were eager to tap the country’s “critical mix of talent and global business service expertise.”
ADVERTISEMENT
Executives from pharmaceutical and biotechnology leader Moderna, based in Cambridge, Massachusetts, told President Marcos they intended to set up a vaccine-making facility in the Philippines during a meeting with Filipino officials at Blair House in Washington DC.
Moderna Chief Commercial Officer Arpa Garay and Senior Vice President and General Manager Patrick Bergstedt said they are set to establish a shared service facility, their third in the world.
Garay said the shared service in the Philippines will serve the entire Asia Pacific Region. She underscored they want to explore further the successful public-private partnership between the Philippine government and Moderna.
“We are really excited to have selected the Philippines for the third one primarily because you know the capabilities exist. We have the talent that exists, and we know that the partnership will be one that can be beneficial for both Moderna and the Philippines,” Garay said.
Bergstedt said there are other countries that offered shared services with Moderna but they have chosen the Philippines as the “perfect location” for their third shared service facility in the world.
Moderna was among the pharmaceutical companies that pioneered the production of mRNA COVID-19 vaccines, which were distributed to the Philippines at the height of the pandemic.
Marcos met with the Moderna executives on Tuesday afternoon (Wednesday, Manila time) at the Blair House in Washington DC along with former president and now Senior Deputy Speaker Gloria Macapagal-Arroyo, Speaker Martin Romualdez, Trade and Industry Secretary Alfredo Pascual and Finance Secretary Benjamin Diokno.
Special Assistant to the President Secretary Antonio Ernesto Lagdameo Jr., Philippine Ambassador to the US Jose Manuel Romualdez and DTI Undersecretary Ceferino Rodolfo were also present during the meeting.
Once operational, it will be Moderna’s only shared service facility in Asia and the third in the world following Poland and the United States.
It is expected to employ about 50 health professionals.
ADVERTISEMENT“We are pleased to expand our footprint into the Philippines by establishing an enterprise solutions hub and commercial operations,” Moderna Chief Executive Stéphane Bancel said in announcing the investment plan. “The Philippines has a critical mix of talent and global business service expertise, which makes it an excellent location to scale efficiently and provide regional support.”
ADVERTISEMENT
Moderna plans to begin operations in the Philippines in the second or third quarter of 2023.
At the same time, the President welcomed the plan of Analog Devices Inc. (ADI) to invest $200 million to build a new R&D facility to add to its semiconductor plant in the Gateway Business Park in Cavite.
During a meeting with the President, ADI executives said they have continued to increase the level of technology that’s been introduced, and are setting up a 300-mm Center of Excellence in Cavite, which is doing all of the company’s wafer programs.
Established in 1965, ADI is a global semiconductor leader.
In August 2021, ADI announced the completion of its acquisition of Maxim Integrated Products, Inc., strengthening its position as a high-performance analog semiconductor company.
ADI’s Philippine counterpart, Analog Devices General Trias, Inc. (ADGTI), engages in the manufacture, assembly, testing and inspection of semiconductor devices.
As of 2022, ADGTI has 5,252 employees, with a total of $394.39 million worth of exports for the same year.
Solar company Maxeon, meanwhile, said it will invest some $900 million (P49.8 billion) in solar energy in the Philippines, while American health care services provider Optum will invest some P800 million in medical business process outsourcing (BPO) in the Philippines.
Bill Mulligan, CEO of Maxeon, which operates the SunPower brand in all global markets, said the investment will provide more than 3,000 jobs in the next few years.
Mulligan said the reason for the expansion efforts is the company’s confidence in the administration of President Marcos, as he looks forward to expanding the engagement with the Philippine government.
“The Philippines has been incredibly important… it’s actually a strategic part of our company. And I want to thank you and I want to thank all of the government agencies for all of the help and the support for the 40 plus years that we’ve been in the country,” Mulligan said.
Mulligan said they are starting the expansion of their R&D facility in Cavite, providing around 2,000 engineering jobs in the area.
Maxeon has been operating in the Philippines since 2003 and opened its first factory at the Laguna Technopark in Biñan City in 2004.
Meanwhile, Optum’s P800 million medical BPO investment is set to employ some 1,500 Filipinos.
John Prince, president and COO of Optum, said the firm is committed to the Philippines and lauded the “strategic partnership that we have for a very long time.”
“I’m a really big believer that great things happen to great teams and we have a great team in the Philippines,” Prince said.
In March this year, Optum met with the Board of Investments (BOI) to discuss details of their planned new project in Davao and queries on the importation of equipment.
Since 2011, UHG/Optum has invested P5.1 billion in capital expenditure in operating four sites in Taguig, Muntinlupa, Quezon City and Cebu City.
In a separate meeting, the President welcomed the decision of BPO company Atento to set up its first call center in the Philippines at the Iloilo Business Park in Madurriao, Iloilo.
President Marcos told Atento officials that they made the right decision in choosing the Philippines as their location as “Filipinos speak and write the best English.”
“I know it will be successful because it has been successful in the past. It has been a go-to industry for the Philippine government for quite a long time now,” Mr. Marcos said.
President Marcos met with Atento President Fili Ledezma Soto and Chief Delivery Officer Josh Ashby at the Blair House as part of his official trip to the US.
Atento officials assured the President and the Philippine government officials of their commitment to start their call center in Iloilo.
Atento is a customer relationship management and business process outsourcing company operating in Argentina, Brazil, Chile, Columbia, El Salvador, Guatemala, Mexico, Morocco, Panama, Peru, Puerto Rico, Spain, Uruguay and the US.
Atento is projected to provide employment opportunities for around 554 workers in the first year and 665 workers in the second year, bringing in an investment of P21.4 million.
Also on Tuesday, a seafaring industry executive told President Marcos that US firms are set to hire some 75,000 Filipino seafarers in the next three to four years. John Padget, president and CEO of Carnival Corp. said his group of companies is set to hire the Filipino seafarers and praised Filipino workers for their hospitality and competitiveness in the global workforce.
“It doesn’t matter whether it’s the marine, deck, hospitality, restaurant…everything is based on the happiness, the smile, and the greatness of the Filipino employees,” he said.
President Marcos thanked the US employers for their continued confidence in Filipino professionals and skilled workers.
Meanwhile, an organization of prominent Filipino and American civic and business leaders vowed greater cooperation and partnership in the development and Philippine economy.
The United States-Philippines Society, co-chaired by Ambassador John D. Negropotente, made the commitment following the group’s meeting with President Marcos.
Negroponte, who was US ambassador to Manila from 1993 to 1996, said Marcos’ visit to Washington laid the framework for the commitment of the group to support the Philippines.
“(The) President’s visit… sets the table for our work…in the months and years ahead. Thank you for that,” Negroponte told President Marcos.
Also known as The Society, the USPS is a non-profit, bi-national organization of prominent civic and business leaders of the US and the Philippines.
The Society was organized in May 2012 with the aim of enhancing and awareness of the profile of the Philippines in the United States in the areas of security, trade, investments, tourism, the environment, history, education and culture.
Negroponte noted the positive developments of President Marcos’ meeting with US President Joseph Biden last Monday.
Michael DiPaula Coyle, head of international trade policy government and regulatory affairs of IBM, a member of the US-PH Society, said they are “very, very bullish” on the Philippine economy and look forward to working with the government to invest in digitalization.
“We’re also very heavily invested in helping grow your talent pool through skills development programs,” Coyle said. “We’ve had a number of partnerships with the US government with your government to improve skills development particularly in areas like… AI and cybersecurity where I think the Philippines has an enormous opportunity to position yourselves as very competitive economy particularly in the IT services sector.”
Speaker Romualdez said the hard work of the President has paid off with investments that would boost the Philippine economy and create jobs for thousands of Filipinos.
This developed following a series of engagements that the President and his delegation held in Washington D.C. with various leading US firms on the third day of his official visit to the US.
ADVERTISEMENT
“It is heartening to note that the President’s mission to the US has scored significant gains that would not only spur further economic growth but more importantly, result in direct benefits for thousands of Filipino workers in terms of job created,” Romualdez said.
ADVERTISEMENT
"
25,"Mr. Marcos, delegation off to London today for coronation of King Charles",byVince Lopez,"May 4, 2023,","President Ferdinand Marcos Jr., First Lady Liza Araneta-Marcos, and their family are leaving the United States today to proceed to London for the Grand Coronation of Britain’s King Charles III slated on May 6, joining other world leaders and dignitaries.
ADVERTISEMENT
The First Family’s trip, following the President’s five-day official visit to the US, is in response to the invitation sent by the United Kingdom to Mr. Marcos as relayed by UK Ambassador Laure Beaufils.
In a statement, Malacañan Palace confirmed the President had accepted the invitation for his attendance at the coronation of the new British sovereign. It was still unclear at presstime who in the presidential entourage to the US would accompany the Marcoses to London as well.
The coronation will be held at Westminster Abbey on Saturday (Sunday in Manila), the Presidential Communications Office said.
The PCO said Mr. Marcos and the First Lady accepted the invitation of the Master of the Household, upon command of His Majesty, to a reception at Buckingham Palace on May 5 ahead of the coronation of King Charles and Her Majesty the Queen Consort, Camilla Parker-Bowles.
A trip to Indonesia soon follows for Mr. Marcos as he attends the Association of Southeast Asian Nations (ASEAN) Summit.
The trip slated from May 10 to 11 is upon the invitation of ASEAN chair Indonesian President Joko Widodo, according to the Department of Foreign Affairs (DFA).
The Palace has yet to release the list of the people who will be accompanying the President and the First Lady to the UK.
According to Philippine Ambassador to the UK Teodoro Locsin Jr., President Marcos personally knew King Charles during his early adulthood, and they even had a chance to play polo together.
Charles became king when his mother Queen Elizabeth II died last September 8. He also took over as head of state of 14 Commonwealth countries, including Australia, Canada, and New Zealand.
Charles Philip Arthur George chose his regnant name Charles III following his ascension to the throne. His mother Queen Elizabeth was the longest-reigning British monarch, which also made him the longest-serving Prince of Wales.
ADVERTISEMENTUK Prime Minister Rishi Sunak is eager to meet President Marcos at the coronation, Ambassador Beaufils said on Tuesday.
ADVERTISEMENT
The British envoy said they were working on setting up a meeting between the two leaders on Saturday, the day of the coronation, but nothing had been finalized.
“We hope so. The Prime Minister said that he would very much like to meet President Marcos so we’re in the process of trying to make that happen. We very much hope that the meeting will take place Saturday and we think it’s likely to take place on Saturday,” she added.
In a media briefing on Friday, Angelito Nayan, Deputy Assistant Secretary of the DFA-Office of ASEAN Affairs, said Mr. Marcos is expected to “assert the importance of demonstrating ASEAN centrality in the region amid geopolitical rivalries.”
The Chief Executive is also seen to advance the Philippines’ priorities in ASEAN by boosting cooperation in various areas such as food and energy security, economic recovery, and protection of migrant workers, among others.
“One of the important outcomes of this summit is the leaders’ declaration on combatting trafficking in persons caused by the use and misuse of technology,” Nayan said.
“This is something that the Philippines fully supports — owing to our advocacy in ASEAN on the protection of migrant workers, and the Philippines’ role as lead shepherd for ASEAN cooperation against trafficking,” he added.
ADVERTISEMENT
"
26,4 million kilos of smuggled sugar to be sold cheap at Kadiwa stores,byMacon Ramos-Araneta,"May 4, 2023,","At least 4,000 metric tons or 4 million kilos of seized smuggled sugar were approved to be sold at Kadiwa outlets at a cheaper price, the Sugar Regulatory Administration (SRA) said on Wednesday.
ADVERTISEMENT
At the televised public briefing, SRA acting administrator Pablo Luis Azcona said the sugar will be sold at P70 per kilo.
“We still have an additional 6,000 MT confiscated sugar. Hopefully, it will also be released once it is proven safe and approved for sale, for donation to Kadiwa,” he added.
Meanwhile, Sen. Risa Hontiveros slammed those behind the spike in sugar price to P136 per kilo as “robbing the consumers.”
She said Malacanang, the Department of Agriculture, and SRA’s Azcona should know the reason for the spike since “they created the sugar cartel.”
“This is not just ‘tubong lugaw’ (profit far exceeding investment) but outright robbery of consumers across the country who are being forced to carry this with the help of corruption and mismanagement,” Hontiveros said.
The senator said the local sugar refineries or azucarera had already sold their supply to traders, and that according to former SRA Administrator Rafael Coscolluela, this should have lowered the cost of sugar from P86 to P90 per kilo.
And since 170,000 metric tons of sugar from All Asian Countertrade, Sucden Philippines and Edison Lee Marketing have entered the market, Hontiveros said sugar can be sold in the market at P70 per kilo without losses for retailers.
“So instead of the price of sugar going down, why the increase?” she asked, while lambasting the additional P40 to P60 passed on to Filipinos.
“It appears that retailers, food producers, traders, wholesalers and the market are taking their cues from the favored importers and their irregularities,” the senator added.
Wholesalers, she said, may be aligning their price offers with those of the cartel.
ADVERTISEMENTHontiveros said food producers, traders and retailers were forced to buy sugar even at high prices “because there’s no other source.”
ADVERTISEMENT
They are also fearful of running out of stocks “because rumors are rife that Sucden (Philippines Inc., an importer and distributor) does not have enough capital to import the 100,000 metric tons assigned to them,” she added.
“Are retail price controls the solution? Not if they’re not the ones who padded the unbelievably high prices. This would probably result in a greater lack of supply of sugar in our retail markets,” the senator said.
It should be remembered, Hontiveros said, that apart from the earlier imports, Sugar Order No. 6 obligated the three government-approved importers to buy 440,000 metric tons of sugar from local suppliers.
“This means that the cartel can control almost 880,000 metric tons of sugar, which will surely be sold at high prices to the public. That’s part of the market’s fears,” she said.
Instead of price control on sugar retail prices, the senator said the government should focus on price monitoring and control for wholesale purchases, “because that’s where the powerful cartels can dictate prices.”
Hontiveros noted that about 260,000 metric tons need to be imported from Thailand to reach the supply the country needs.
“The SRA should act now and give import licenses to qualified importers as provided by Sugar Order No. 6. We hope the government moves now before sugar supplies fall even more, leading to a higher spike in prices,” she said.
ADVERTISEMENT
"
27,Brace for new heat records: UN raises alert on El Niño by July,byAFPandRio N. Araja,"May 4, 2023,","The United Nations warned Wednesday of a growing likelihood the weather phenomenon El Nino will develop in coming months, fueling higher global temperatures and possibly new heat records.
ADVERTISEMENT
The UN’s World Meteorological Organization said it now estimated there was a 60-percent chance that El Nino would develop by the end of July, and an 80-percent chance it would do so by the end of September.
“This will change the weather and climate patterns worldwide,” Wilfran Moufouma Okia, head of WMO’s regional climate prediction services division, told reporters in Geneva.
El Nino, which is a naturally occurring climate pattern typically associated with increased heat worldwide, as well as drought in some parts of the world and heavy rains elsewhere, last occurred in 2018-19.
Since 2020 though, the world has been hit with an exceptionally long La Nina — El Nino’s cooling opposite — which ended earlier this year, ceding way to the current neutral conditions.
And yet, the UN has said the last eight years were the warmest ever recorded, despite La Nina’s cooling effect stretching over nearly half that period.
Without that weather phenomenon, the warming situation could have been even worse.
Global heating spikes likely
La Nina “acted as a temporary brake on global temperature increase,” WMO chief Petteri Taalas said in a statement.
Now, he said, “the world should prepare for the development of El Nino.”
The expected arrival of the warming climate pattern, he said, “will most likely lead to a new spike in global heating and increase the chance of breaking temperature records.”
ADVERTISEMENTAt this stage, there is no indication of the strength or duration of the looming El Nino.
ADVERTISEMENT
The last one was considered very weak, but the one before that, between 2014 and 2016, was considered among the strongest ever, with dire consequences.
WMO pointed out that 2016 was “the warmest year on record because of the ‘double whammy’ of a very powerful El Nino event and human-induced warming from greenhouse gases”.
Since the El Nino effect on global temperatures usually plays out the year after it emerges, the impact will likely be most apparent in 2024, it said.
“We are expecting in the coming two years to have a serious increase in the global temperatures,” Okia said.
More extreme weather
Taalas highlighted that the expected arrival of El Nino could have some positive effects, pointing out that it “might bring respite from the drought in the Horn of Africa and other La Nina-related impacts”.
But it “could also trigger more extreme weather and climate events” he said, stressing the need for effective early warning systems “to keep people safe.”
No two El Nino events are the same and their effects depend, in part, on the time of year, WMO said, adding that it and national meteorological services would be closely monitoring developments.
The climate pattern occurs on average every two to seven years, and usually lasts nine to 12 months.
It is typically associated with warming ocean surface temperatures in the central and eastern tropical Pacific Ocean.
Increased rainfall is usually seen in parts of southern South America, the southern United States, the Horn of Africa and central Asia, while severe droughts can occur over Australia, Indonesia and parts of southern Asia.
During summer in the northern hemisphere, El Nino’s warm water can also fuel hurricanes in the central and eastern Pacific Ocean, while hindering hurricane formations in the Atlantic Basin, WMO said.
Philippine forecast
THE Philippine Atmospheric, Geophysical and Astronomical Services (PAGASA) on Wednesday said 10 to 14 cyclones could enter the Philippine area of responsibility between May and October amid the El Niño threat.
Ana Lisa Solis, Climate Monitoring and Prediction Section chief, said El Niño characterized by below-normal rainfall could Lead to dry spells and drought in several areas.
The increase in the temperature of the seas could it favorable for tropical cyclones to develop, she noted.
During El Niño, more rains could be expected in western Luzon and other parts of the country, including Metro Manila, Cordilleras, Cagayan Valley, Central Luzon, Calabarzon, Mimaropa and Bicol Region, she said.
“Based on our forecast , there will be 10 to 14 storms from May to October,” she said.
ADVERTISEMENT
“We earlier said that before El Nino hits, there are above normal rainfall conditions. That is our forecast starting June, July: above-normal rainfall conditions,” she added.
ADVERTISEMENT
"
