,Title,Author,Date,Text
21,LTO to simplify driver’s license exams to combat fixers,By Raymond Carl Dela Cruz,,"LTO chief Assistant Secretary Jose Arturo ""Jay Art"" Tugade (PNA photo)
MANILA – The Land Transportation Office (LTO) is looking to shorten its driver’s licensure exams in a bid to simplify transactions and lessen the public’s reliance on fixers.
In a statement on Thursday, LTO chief Assistant Secretary Jose Arturo “Jay Art” Tugade said “lengthy procedures” is one of the reasons why many license applicants resort to paying for fixers -- third-party unauthorized agents who process LTO transactions for a fee.
“The instruction I gave to our committee was to compress the exam. This exam reportedly takes about an hour. The agency is now studying how to shorten the exam. I believe that by reducing the exam duration, our applicants will not seek out fixers and will opt to take the exam themselves,” Tugade said.
The committee, he said, will analyze exam questions and condense the content without sacrificing their purpose to license competent drivers with emphasis on knowledge, skills, and attitude.
The shortened exams being studied are for new non-professional licenses, new conductor’s licenses, changing classification from non-professional to professional, and adding a driver’s license code.
In addition to shortening the exams, he said the committee will also look into customizing exam questions depending on the license classification or driver’s license code the applicant is applying for. (PNA) 
"
22,Solon wants proactive gov't action vs. future avian flu outbreaks,By Leonel Abasola,,"(File photo)
MANILA – A lawmaker on Thursday filed a resolution seeking a Senate inquiry to determine the appropriate government actions to prevent and control the possible outbreak of the avian influenza virus in the country.
""It is high time for the Senate to ensure that risk-based planning, strict prevention protocol, and proactive legislative action are in place to minimize public health risks and fundamentally, to accord our local poultry sector with the support and opportunity as active partners in development and nation building,"" Senator Francis Tolentino said in filing Senate Resolution 580.
Reports submitted by the Bureau of Animal Industry (BAI) showed that as of Feb. 9, nine regions remained affected by avian flu.
According to the BAI report submitted to the National Banner Program Committee on Poultry and Livestock on Feb. 14, more than 300,000 poultry mortalities have been recorded since the bird flu outbreak in 2022.
The World Organization for Animal Health earlier warned that the presence of avian flu ""may restrict international trade in poultry meat that can heavily impact economies.""
In May 2022, the A-H5 variant outbreak in wild birds and poultry was reported to have spread to 16 countries in Latin America and the Caribbean, the United States, and Canada, with the first human infection recorded in Ecuador in January 2023. This also led to the deaths of hundreds of sea lions and pelicans in Peru.
Tolentino said reports on the inventories of imported chicken in various commercial public wet markets in Metro Manila showed that they were sourced from Brazil, the US, Netherlands, or Canada with expiration dates ranging from 1 year to 2 years from the date of production; or have no labels on the date of production and distribution; or do not have a sticker from the National Meat Inspection Service.
""The sale of the said imported poultry meat brazenly violates the provisions of the law under Republic Act No. 7394, or the 'Consumer Act of the Philippines'... It fails to qualify with the Philippine National Standards on the Code of Hygienic Practice for the Sale of Fresh Agriculture and Fishery Products in Markets and Authorized Outlets,"" he said in his explanatory note.
He warned that the high inventory of imported poultry products amid the unabated importation of finished goods poses a “significant threat” to the immediate and long-term prospects of the local poultry sector in the county, and puts consumers at risk of the potential adverse effect of other transboundary diseases.
“There should be a clear and solid policy from authorities to avert and ward off any possible outbreak of transboundary animal diseases in the country due to the unabated importation of poultry products since it will ultimately lead to adverse public health effects and demise of the Philippine local poultry industry,” Tolentino said. (PNA)
"
23,PH crime rate down 11.36% in first 4 months of 2023,By Christopher Lloyd Caliwan,,"PNP Public Information Office (PIO) chief Col. Redrico Maranan (File photo)
MANILA – The country's crime rate has dropped by 11.36 percent in the first four months of this year, a ranking police official said Thursday.
In a Laging Handa briefing, Philippine National Police (PNP) Public Information Office chief Col. Redrico Maranan said a total of 12,226 crime incidents were recorded from January 1 to May 2, as compared to 13,763 crimes in the same period last year.
“Nakapagbaba tayo ng 1,500 plus na krimen at iyan po ay iyong mga eight focused crimes. Kaya nakikita natin, iyong ating different anti-criminality strategies, nakikita naman natin na ito po ay epektibo (We were able to reduce 1,500 plus crimes of the so-called eight focus crimes. That's why we see, our different anti-criminality strategies, we see that it is effective),” he added.
The eight focus crimes include murder, homicide, physical injury, robbery, theft, vehicle theft, motorcycle theft and rape.
Index crimes are serious crimes such as murder, homicide, physical injury, robbery, rape, theft, and carjacking, while non-index crimes are violations of local ordinances and laws and vehicular accidents.
Maranan said that under PNP chief Gen. Benjamin Acorda Jr.'s leadership, the PNP will deploy policemen in barangays identified by the local police forces as crime-prone areas as part of preemptive efforts against criminality.
“The focus of our new PNP chief, Gen. Acorda, is to assign police to crime-prone barangays. We have already identified that and that will be the priority of our deployment… in the crime-prone barangays. And we have also identified police regional offices that will be the ones to lead because in their area of responsibility, that's where we saw those barangays with the most crime occurring,” he added.
Maranan earlier said the move is a strategic action plan as the national police do not have enough manpower to guard over 100 million Filipinos across the country.
Maranan explained that police visibility has been proven as a crime deterrent over the years.
He emphasized the importance of the cooperation of the barangay officials in maintaining peace and order.
He said that strong coordination between the police and the community lies on the cooperation between the two, adding that it is the police commanders who are given the task to initiate it.
“The PNP cannot deploy policemen in each of the barangay. What we do is to cluster the barangay and then we either put up Police Community Precincts, police assistance desks or even a police outpost. We believe that if this is properly implemented, we would be able to reduce the crime, especially in the crime-prone barangays,"" he added. (PNA)
"
24,Comelec eyes use of 2 automated systems for 2025 polls,By Ferdinand Patinio,,"Comelec chairperson George Erwin Garcia (PNA photo by Yancy Lim)
MANILA – The Commission on Elections (Comelec) is looking to use two automated election systems (AES) for the 2025 midterm elections.
In a press conference at the poll body's main office in Intramuros, Manila on Thursday, Comelec chairperson George Garcia disclosed that they want to work with the manufacturer of the machines, as they want to customize the systems to be used in the polls.
“We put on the Terms of Reference (TOR), we want to deal with the manufacturer. We don't want to be just an integrator. What we want is to customize, build the machine for the Comelec. We want to have our own software and we have the option to buy the software, even the hardware,” he said.
Garcia added that the AES they are looking to use are the Direct Recording Electronic (DRE) and Optical Mark Reader (OMR).
“It is a combination of OMR and DRE. We have utilized the OMR, while the DRE is touchscreen. What we want (is) if manufacturers have such (a) combination,” Garcia said. “The recommendation of the Comelec Advisory Council is also the same as what we want, OMR/DRE.”
The Comelec head noted that they plan to use the DRE for Overseas Voting and the OMR for the domestic polls.
Asked if both AES would be used at the same time, Garcia said, “No, only one AES will be used. The other feature will be disabled. If the DRE is being used, the OMR will be dissolved and vice versa.”
As for the transmission package, Garcia said they would come up with a separate TOR.
“There will be a separate TOR for transmission because the Comelec would like to make sure that it is in full control and that the telcos (telecommunications companies) that will win the procurement will report directly to us. All other collaterals, software, hardware, it’s with the winning bidder,” he said.
At the same time, Garcia noted that they could revise the TOR in case some of the features are not available in the market.
“The Commission en banc voted unanimously on the TOR. In case we were informed that it is not available in the market, we can easily revise the TOR. But this early, we want the manufacturers to know what we need. We can procure by July this year so that we can award by January or February next year and then we will conduct end-to-end testing,” he said. “Take note, this is lease with option to purchase. We don't want to purchase yet since we would like to try the system first... Finally, (the) machine should be upgradeable so this can be used in future elections.”
Earlier, the poll body said they are no longer using the 97,000 vote counting machines that were used in the past three elections. (PNA)
"
25,House accepts PBBM challenge to forge closer PH-US ties,By Zaldy De Layola,,"MANILA – House Speaker Ferdinand Martin G. Romualdez on Wednesday (US time) welcomed the suggestion of President Ferdinand R. Marcos Jr. that efforts to boost the long-standing bond of friendship between the Philippines and the United States should also involve the respective legislative branches of the two countries.
Romualdez said the House of Representatives is ready to take up the challenge of strengthening the long-standing ties between the two nations through consistent engagements of each country’s lawmakers.
“We, at the House of Representatives, welcome the suggestion of President Ferdinand ""Bongbong"" R. Marcos Jr. that efforts to boost the long-standing bond of friendship between the Philippines and the United States should also involve the respective Legislative branches of the two countries,” the Speaker said.
“We are ready to take up that challenge and we look forward to more engagements with our counterparts in the United States in the future,” he added.
On Wednesday, Marcos and members of his delegation met with key members of the US Senate and discussed with them various issues that include security, defense, agriculture and climate change mitigation, economic cooperation and cyber security.
During the meeting, Marcos thanked Senator Robert Menendez, chairman of the Senate Foreign Relations Committee, and other members of the panel for welcoming his delegation to Capitol Hill.
It was also during the said meeting when Marcos noted that engagements between Manila and Washington should not only take place at the executive department but also with members of the legislature of both governments.
“While the conduct of foreign relations is largely the domain of the Executive, engagements between the lawmakers of both countries would be of immense value in, for instance, harmonizing the legal framework governing their bilateral relations,” Romualdez noted.
He added that with closer personal relations engendered through such engagements, the lawmakers of both countries would help deepen the level of appreciation and understanding on issues of mutual concern and thus promote even closer cooperation and partnership.
“We have actually taken the initiative to move toward the direction suggested by President Marcos,” Romualdez said.
It could be recalled that in mid-April, Speaker Romualdez along with several members of the House, flew to the United States where they engaged with key congressional leaders to lay the groundwork for the official visit of Marcos to the United States. (PNA)
"
26,Gatchalian swears in Romualdez as new DSWD undersecretary,By Zaldy De Layola,,"NEW USEC. Department of Social Welfare and Development Secretary Rex Gatchalian administers the oath of office to newly appointed Undersecretary Monina Josefina H. Romualdez on Tuesday (May 2, 2023). Romualdez was the former DSWD-NCR Field Office regional director. (Photo courtesy of DSWD)
MANILA – Former Department of Social Welfare and Development (DSWD) regional director Josefina H. Romualdez is now the new undersecretary for operations of the agency, a news release said on Thursday.
Secretary Rex Gatchalian, it said, administered the oath-taking of the newly appointed undersecretary on May 2 at the DSWD Central Office in Batasan Hills, Quezon City.
Romualdez, who was the former DSWD-NCR Field Office regional director since President Ferdinand R. Marcos Jr. assumed office in 2022, will now take the helm of the Operations Group of the Department.
As the new undersecretary for operations, Romualdez will oversee the implementation of the different social welfare and development programs and other services of the department, as mandated by laws, including the directives from the President and the DSWD secretary.
With her year-long experience in the operations of the biggest DSWD field office in the country, Romualdez has gained the necessary management skills and knowledge to effectively lead the operations group of the department.
Romualdez vowed to serve the public, particularly the vulnerable and marginalized sectors for the protection and promotion of their rights and welfare, to the best of her ability. (PNA)

"
27,PBBM calls for PH GSP renewal to boost trade,By Filane Mikee Cervantes,,"President Ferdinand R. Marcos Jr. (Photo courtesy of the Office of the President)
MANILA – President Ferdinand R. Marcos Jr. has called for the renewal of the Philippines’ participation in the United States Generalized System of Preferences (GSP) trade program.
In a speech at a forum organized by the US-ASEAN Business Council and US Chamber of Commerce roundtable and reception at the Blair House in Washington DC on Wednesday (US time), Marcos said the program would increase trade with the US and promote competition.
The country’s eligibility for the US GSP program, which allows the duty-free entry of several Philippine products to the US market, expired on Dec. 31, 2020.
“We would like to request for reauthorization… to boost trade and to make US products that are made in the Philippines more competitive,"" he said.
Invest in PH
Aside from strengthening trade relations between the two countries, the President also called on US companies to invest more in the Philippines as the country has stepped up efforts to “create an atmosphere that is attractive to potential investors and we continue that process.”
He touted before American business executives the Philippine economy’s growth, which stood at 7.6 percent last year.
“This is the effect of our very aggressive efforts really to promote the Philippines as an investment destination,” Marcos said. “We will never, at any point, say we got it perfected. We will continue to listen to you and to all our other partners as to what else we can do to help transform our economy and, in that way, to be able to play a viable part in the security and defense issues that are the challenges of the day and of the region.”
He noted that the US-Philippines alliance is in the “front and center right now,"" overcoming ""some bumps and scrapes"" over the past years, as he emphasized that defense and security remain the priority areas of cooperation.
“But now, the security and defense are top of mind… we also have to see that because our economies and our societies have grown more complex, everything, it hinges on everything else and… it is very hard for us to separate and say that this is a discreet sector that does not affect any other sector,” he said.
Marcos also highlighted the government's efforts to advance the digital transformation of the Philippines, particularly supporting the “smart industry readiness” of several semiconductor and electronics manufacturing services companies “to help them craft their digital transformation roadmaps.""
The President said the country is also optimistic about the future increase in exports of solar and photovoltaic-related products from the Philippines as many countries strive to comply with their decarbonization targets.
He noted that with the trend toward electric vehicles, Philippine exports geared towards electric vehicle use, such as wire harnesses, rubber tires, and automotive electronics have good potential.
Marcos said the country is also optimistic about increasing its exports of solar and photovoltaic-related products from the Philippines as many countries strive to comply with their decarbonization targets.
The semiconductor industry, on the other hand, can gain more from increasing skills in research and development, he pointed out.
Present at the forum were top American businessmen and Filipino tycoons, among them Jaime Zobel de Ayala, Enrique Razon, Tessie Sy Coson, and Kevin Tan. (PNA)
 
 
"
28,Legarda wants tax incentives for salt industry investors,,,"(File photo)
MANILA – To revitalize the country’s salt industry and reduce our dependence on importation, Senate President Pro Tempore Loren Legarda is batting for the passage of a measure that seeks to provide attractive incentives to industry investors.
In pushing for Senate Bill No. 1870, or an Act Strengthening and Revitalizing the Development of the Salt Industry in the Philippines, Legarda, in a press release said on Thursday, that the country’s salt industry has the potential to be a significant driver of economic growth and income-generating opportunities for the Filipino people.
She pointed out that the possibilities of the salt industry for the Philippines' overall economic performance are endless, but noted that over the past years, the country has been importing around 550,000 metric tons of salt, equivalent to 93 percent of the nation's salt requirement.
The Philippine Association of Salt Industry Networks (PhilAsin) expects these numbers to increase in the coming years because of the rapidly growing population.
Thus, Legarda said that government support is vital in addressing the challenges and gaps in making the salt industry competitive, reduce dependence on importation, and create more conducive jobs for salt farmers.
To boost local production, the advocate for sustainable livelihood programs emphasized providing substantial and attractive incentives to investors.
The lawmaker added that salt farmers should be given priority through financial and technical assistance that can promote sustainable salt production.
These can be through machines, new technologies, and elaborated research and development studies to identify further and support the industry's changing needs, she said.
Likewise, more improved policies should be considered, as well as a diverse collaboration between government agencies and stakeholders that will shepherd the formulation and implementation of the Philippine Salt Industry Development Roadmap.
""As legislators, the future of the salt industry lies in our hands. We should all consider this a shared aspiration and commitment to act tirelessly to save what's left of the industry. We will all benefit from this sector's potential for our nation's inclusive growth,"" Legarda said. (Leonel Abasola/PNA)
"
29,"NCR, Central Luzon top sales from Labor Day 'Kadiwa' for workers",By Ferdinand Patinio,,"(Photo courtesy of DOLE Facebook page)
MANILA – The “Kadiwa ng Pangulo para sa Manggagawa” in the National Capital Region (NCR) and Central Luzon logged the highest amounts of sales from the nationwide event held in celebration of Labor Day.
Citing its latest data as of May 2, the Department of Labor and Employment (DOLE) said the two regions contributed more than PHP1 million in sales out of more than PHP6.4 million in total revenues generated from the activity.
The Kadiwa in the NCR, held at the SMX Convention Center in Pasay City on April 30 and was graced by President Ferdinand R. Marcos Jr., recorded PHPP1,009,903.24 in sales.
A total of PHP1,009,056.15 in earnings were recorded by Kadiwa outlets in Central Luzon, located in San Jose del Monte City, Bulacan; Angeles City, Pampanga; and Mariveles, Bataan.
It added that other Kadiwa ng Pangulo para sa Manggagawa sites in Luzon recorded the following sales: Cordillera region, PHP193,583; Ilocos region, PHP464,769; Cagayan Valley, PHP302,418; Calabarzon, PHP137,654; and Bicol region, PHP673,056.87.
As for the Kadiwa outlets in the Visayas and Mindanao reported the following sales: Western Visayas, PHP214,838; Central Visayas, PHP636,362; Eastern Visayas, PHP472,296.75; Zamboanga Peninsula region, PHP288,834; Northern Mindanao, PHP280,801.75; Davao region, PHP147,436; Soccsksargen, PHPP203,338.95; and Caraga, PHP555,756.57.
In celebration of Labor Day, the labor department set up 29 Kadiwa ng Pangulo para sa Manggagawa outlets nationwide where affordable and quality products were offered by 606 enterprises and 1,223 sellers to Filipino workers.
Kadiwa enables the farming community to sell goods directly to consumers without the trader-intermediaries, allowing them to reap higher profits while still offering quality products at an affordable price to consumers.
The DOLE said the data is expected to increase as sales reports from other regional offices are still coming in. (PNA)
"
