,Title,Author,Date,Text
30,"Attacks vs. US, PH ships, aircraft in Pacific, SCS to trigger MDT",By Priam Nepomuceno,,"US Defense Secretary Lloyd J. Austin III (left) and Department of National Defense chief Carlito Galvez Jr. (right) (File photo)
MANILA – The Bilateral Defense Guidelines between the United States and the Philippines have emphasized that an attack in the Pacific, including any part of the South China Sea against public vessels, aircraft or armed forces of the two nations will result in the invocation of the Mutual Defense Treaty (MDT) commitments.
""The guidelines reaffirm that an armed attack in the Pacific, including anywhere in the South China Sea, on either of their public vessels, aircraft, or armed forces – which includes their Coast Guards – would invoke mutual defense commitments under Articles IV and V of the 1951 US-Philippines MDT,"" it added.
The guidelines were established on Wednesday by Defense Secretary Lloyd J. Austin III and his Filipino counterpart Carlito Galvez Jr.
""Recognizing that threats may arise in several domains – including land, sea, air, space, and cyberspace – and take the form of asymmetric, hybrid, and irregular warfare and gray-zone tactics, the guidelines chart a way forward to build interoperability in both conventional and non-conventional domains,"" it noted.
The Bilateral Defense Guidelines also aims to modernize alliance cooperation in service of the United States and the Philippines’ shared vision for a free and open Indo-Pacific Region.
The guidelines are informed by the following goals with the aim of strengthening the United States and the Philippines’ combined deterrence in an evolving security environment, including:
-- Reaffirm the US-Philippines MDT’s enduring relevance in addressing both current and emerging threats;-- Foster a common understanding of roles, missions, and capabilities within the framework of the alliance to face regional and global security challenges;
-- Drive unity of effort across all areas of bilateral security and defense cooperation to sustain focus on principal regional security concerns; and;
-- Guide priority areas of defense cooperation to address both conventional and non-conventional security challenges of shared concern.
The guidelines identify multiple lines of effort to advance these objectives, including the following:
Modernizing defense capabilities
-- Coordinate closely on the Philippines’ defense modernization, including through the completion of a Security Sector Assistance Roadmap, to identify priority defense platforms and force packages that will bolster combined deterrence and capacity to resist coercion.
-- Prioritize the procurement of interoperable defense platforms sourced from US programs and Philippine national defense procurement and funding initiatives.
-- Expand investments in non-materiel defense capacity building including through education and training exchanges, exercises, and other operational activities.  
Deepen interoperability
-- Orient bilateral exercises and activities around improving our combined ability to counter armed attacks on either country as well as threats in space and cyberspace, while expanding the scope, scale, and complexity of exercises.
-- Expand cooperation on maritime security and maritime domain awareness, including through the continued conduct of combined maritime activities, including but not limited to joint patrols.
-- Deepen cooperation under the Enhanced Defense Cooperation Agreement (EDCA) to strengthen interoperability, including through infrastructure improvements; enhanced joint use of facilities; advancement of additional maritime security, maritime domain awareness, and humanitarian assistance and disaster relief capabilities; and rotational US access to agreed locations.
-- Enhance bilateral planning and information-sharing.
-- Conduct coordinated analysis, tabletop exercises, and training and exercises to reinvigorate bilateral planning and coordination efforts; assess bilateral requirements; and advance common objectives and approaches to shared challenges.
-- Develop adaptable decision-making processes and communication procedures to support flexible, timely, whole-of-government bilateral coordination and action to respond to conventional and unconventional warfare.
-- Broaden information sharing on early indicators of threats to the peace and security of both countries to ensure preparedness to address principal challenges confronting the alliance.
-- Strive toward real-time information sharing in collaboration with other departments and agencies to support deeper interoperability and operational coordination.
-- Enhance information security through consultations on policies, practices, and procedures for the protection of classified defense and military information.
Combat transnational and non-conventional threats
-- Improve cyber defense and cyber security cooperation to secure critical infrastructure and protect against attacks emanating from state and non-state actors.
-- Pursue capacity-building activities to respond to chemical, biological, radiological, and nuclear-related attacks and to counter the proliferation of weapons of mass destruction. Contribute to global and regional peace and security.
-- Sustain participation in multilateral fora, anchored in shared support for ASEAN centrality.
-- Prioritize trilateral and other forms of multilateral cooperation based on common issues of shared concern, including pursuing opportunities for third-party participation and observation in bilateral US-Philippine defense activities. (PNA)
"
31,Magnitude 5.8 quake jolts Isabela,By Ma. Cristina Arayata,,"Quake epicenter (Image grabbed from Phivolcs Facebook page)
MANILA – A magnitude 5.8 earthquake jolted Isabela on Thursday, the Philippine Institute of Volcanology and Seismology (Phivolcs) said.
The tectonic quake struck 15 kilometers northeast of the municipality of Maconacon at 8:49 a.m. It was 42 km deep.
Intensity V was felt in Peñablanca, Enrile and Tuguegarao City in Cagayan. Intensity IV was reported in City of Batac, while Intensity II was felt in Pasuquin, Bacarra and City of Laoag, all in Ilocos Norte.
Phivolcs also logged the following instrumental intensities:
Intensity V - Peñablanca, Cagayan
Intensity IV - Gonzaga, Cagayan
Intensity III - Ilagan, Isabela
Intensity II - Casiguran, Aurora; Pasuquin, Laoag City, Batacin Ilocos Norte; Vigan City, Ilocos Sur; Santiago City, Isabela; Tabuk, Kalinga; Madella, Quirino
Intensity I - Bangued, Abra; Diapaculao, Baler, Aurora; Narvacan, Ilocos Sur; Bayombong, Nueva Vizcaya.
Reported intensity is the traditional way of knowing the intensity based on reports of people who felt the earthquake while instrumental intensity is measured using an intensity meter that measures ground acceleration.
Phivolcs said aftershocks are likely, but damage is not expected from the quake. 
 
locos Norte
In Ilocos Norte, hospital workers and patients of the government-run Mariano Marcos Hospital and Medical Center rushed out of the building after feeling mild shaking of the ground.
Safety officers only allowed them to return 30 minutes later when the building has been assessed safe for occupancy.
 
Residents in these areas were advised to take precautionary measures as aftershocks are expected. No damage was recorded so far, authorities said. (with reports from Leilanie Adriano/PNA) 
"
32,"OCD urges public to heed El Niño advisories, warnings",By Priam Nepomuceno,,"(PNA photo by Yancy Lim)
MANILA – The Office of Civil Defense (OCD) reminded the public to heed authorities’ advisories on El Niño and implement necessary measures in preparation for the impacts of the phenomenon.
This came after the Philippine Atmospheric, Geophysical and Astronomical Services Administration (PAGASA) raised its monitoring status from El Niño watch to El Niño alert on Tuesday.
In a memorandum dated May 3, the National Disaster Risk Reduction and Management Council (NDRRMC) directed regional DRRMCs and OCD regional offices to implement preparedness actions which include close monitoring of warnings from PAGASA, issuance of reminders on water and energy conservation, the maintenance of water distribution systems to prevent wastage.
This also includes the strengthening of risk communication and localization of warnings and reminders to communities, adherence to the public health advisory for El Niño and minimum health standards for Covid-19 issued by the Department of Health, and the submission of regular reports to NDRRM Operations Center.
An interagency meeting was also held last April 24 which was presided by OCD Administrator Undersecretary Ariel Nepomuceno. Nepomuceno emphasized the need to identify and harmonize short term solutions, medium term and long term solutions of concerned government agencies for the El Niño phenomenon.
The composition of the proposed El Niño team to be led by the Department of the Interior and Local Government, was presented by OCD which also serves as team co-chair, with the Department of Agriculture, Department of Environment and Natural Resources, Department of Energy, Department of Health, Department of Science and Technology, National Economic and Development Authority, National Irrigation Administration and Metropolitan Waterworks and Sewerage System as members.
It has a support team composed of the Presidential Communications Office, Department of Trade and Industry, National Water Resources Board and Armed Forces of the Philippines.
On Wednesday, various government agencies met to discuss updates and the ways forward in preparation for El Niño.
“Let’s work together to make sure that we will be able to comply with the President’s (Ferdinand R. Marcos Jr.) guidance and do what is expected from us in the first place,” OCD deputy administrator Assistant Secretary Bernardo Rafaelito Alejandro IV said in a statement.
The El Niño Watch was in effect from March 23 to May 1 before PAGASA raised the monitoring status to El Niño Alert.
“PAGASA has been continuously monitoring the developing El Niño conditions in the tropical Pacific. Recent conditions and model forecasts indicate that El Niño may emerge in the coming season (June-July-August) at 80 percent probability and may persist until the first quarter of 2024. With this development, the PAGASA El Niño Southern Oscillation (ENSO) Alert and Warning System is now raised to El Niño Alert,” the state weather bureau said in its advisory.
El Niño increases the likelihood of below normal rainfall conditions which could bring negative impacts such as dry spells and droughts in some areas of the country, PAGASA added. (PNA)
"
33,Scattered rain showers continue over most of PH,By Ma. Cristina Arayata,,"MANILA – The Visayas and some parts of Luzon and Mindanao will continue to experience rain showers due to the low pressure area (LPA) and the intertropical convergence zone (ITCZ), the weather bureau said Thursday.
These weather systems will bring scattered rain showers and thunderstorms over the Visayas, Zamboanga Peninsula, Palawan, Romblon, Masbate, Catanduanes, Albay, Sorsogon, Dinagat Islands, Surigao del Norte and Surigao del Sur.
The Philippine Atmospheric, Geophysical and Astronomical Services Administration (PAGASA) said these areas may experience flash floods or landslides due to moderate with at times heavy rains.
The LPA last tracked 130 kilometers southeast of Cuyo, Palawan and is embedded along the ITCZ has a moderate to high chance of developing into a weak tropical cyclone, said PAGASA forecaster Benison Estareja.
He added that the LPA would continue to move westward, and will be named Betty once it develops into a tropical cyclone.  
Warm and humid weather due to easterlies will continue to prevail over Metro Manila and the rest of the country.
Isolated rain showers caused by localized thunderstorms are still likely.
Light to moderate winds and slight to moderate seas will continue to prevail across the country, PAGASA said. (PNA)
"
34,Christening of Navy's 2 new Israeli missile boats set May 8,By Priam Nepomuceno,,"(Photo courtesy of Philippine Navy)
MANILA – The Philippine Navy (PN) announced that it will be conducting a christening ceremony for the two newly delivered fast attack interdiction craft-missile (FAIC-Ms) on May 8.
In an advisory to reporters Thursday, Navy spokesperson Capt. Benjo Negranza said the event will be held at Naval Station Pascual Ledesma, Fort San Felipe, Cavite City at 9 a.m.
These FAIC-Ms will be christened BRP Gener Tinangag (PG-903) and BRP Domingo Deluana (PG-905).
The namesake of these ships were both Marine personnel who were awarded the Medal of Valor, the highest military decoration for courage, bravery and self sacrifice above and beyond the call of duty. Both men died on the battlefield.
Aside from the christening rites, the PN will also hold a blessing ceremony for its Naval Shipbuilding Center which is also located at the same facility.
The guest-of-honor and speaker for these events will be Senate President Juan Miguel Zubiri. These two ships were delivered to the Philippines last April 11.
""Said FAIC-Ms, which are part of the nine platforms contracted with Israel Shipyards, arrived from Israel on board the general cargo ship M/V Mick. They were unloaded with the assistance of BRP Mamanwa (LC-294) and proceeded to the naval shipyard in Cavite for a series of tests and crew training,"" Negranza earlier said.
These FAIC-Ms will soon join the Acero-class patrol gunboats along with frontrunners BRP Nestor Acero (PG-901) and BRP Lolinato To-ong (PG-902) which were commissioned last November.
""They are a welcome addition to the Navy's capability to secure vital choke points, key sea lines of communication, and littoral areas of the country,"" Negranza said. Five more are expected to be delivered within the next two years.
The 32-meter long FAIC-Ms are high-speed vessels equipped with quick intercept ability, remote stabilized weapons, and short-range missiles that are capable of delivering precision strikes against larger hostiles and high-value targets on land and sea.
Four of the FAIC-Ms will be armed with non-line-of-sight (NLOS) missiles with pinpoint accuracy and a range of 25 kilometers while the other five will be armed with Typhoon-mounted 30mm main cannons and .50 caliber heavy machine guns.
The acquisition of these FAIC-Ms is among the 2019 projects approved by former President Rodrigo Duterte under the Horizon 2 List of the Armed Forces of the Philippines Modernization Program.
The notice of award for the FAIC-M project, worth around PHP10 billion, was issued on Jan. 5, 2021. These are expected to replace PN’s medium-sized patrol craft.
Once deliveries of the FAIC-Ms are completed, these vessels can interdict surface threats and launch NLOS missiles safely using the surrounding littoral areas as maneuver space and cover.
Earlier, PN chief Vice Adm. Toribio Adaci Jr. said the Navy is planning to acquire at least 15 more Israel-made Shaldag Mark V missile boats, which are the basis of its Acero-class patrol gunboats.
He said the additional Acero-class gunboats would help them to meet their requirements in ""patrolling the seas of the country"".
Adaci also said the FAIC-Ms will be assigned to the Littoral Combat Force. (PNA)
"
35,PBBM hails US willingness to work with PH as equal partner,By Filane Mikee Cervantes,,"(Photo courtesy of PCO)
MANILA – President Ferdinand R. Marcos Jr. on Wednesday hailed the United States’ willingness to work with the Philippine government “as an equal, sovereign partner"", noting that defense and security engagement remains the key pillar of Philippines-US bilateral relations.
Marcos made the remark during his meeting with members of the US Senate led by Senator Robert Menendez, chairman of the Senate Foreign Relations Committee, and other members of the panel on Capitol Hill.
Marcos said engagements between Manila and Washington should not only take place at the executive level, but also with members of the legislature.
During the meeting, Marcos and the US Senate members discussed a wide range of issues that include security, defense, agriculture, climate change mitigation, economic cooperation and cyber security.
Other areas of cooperation between the two countries that need to be strengthened, Marcos said, include the supply chain, health and health security, environment, energy security and interconnectivity.
The meeting was part of the President’s ongoing five-day official visit to Washington, which included a series of high-level dialogues with US President Joseph Biden and US Vice President Kamala Harris.
Joining the President in Wednesday's Capitol Hill meeting were Speaker Ferdinand Martin Romualdez, Foreign Affairs Secretary Enrique A. Manalo, Philippine Ambassador to the US Jose Manuel G. Romualdez, Finance Secretary Benjamin Diokno, Justice Secretary Jesus Crispin C. Remulla and Trade Secretary Alfredo Pascual.
Among those who joined Menendez were Senator James Risch as well as other officials of the Senate Committee on Foreign Relations. (PNA)
"
36,PCO vows to promote 'free media environment',By Filane Mikee Cervantes,,"FREE PRESS. Media workers covering Malacañang. The Presidential Communications Office reaffirmed the government's commitment to promoting a free media environment where journalists can work safely without fear of reprisals. (Screenshot)
MANILA – As it marks the 30th World Press Freedom Day, the Presidential Communications Office (PCO) on Thursday reaffirmed the government's commitment to promoting a free media environment where journalists can work safely without fear of reprisals.
In a statement, the PCO acknowledged that journalists and media organizations face threats, intimidation, harassment, violence and other challenges in fulfilling their essential role to provide the public with relevant information.
""On this World Press Freedom Day, the Presidential Communications Office recognizes the vital role of a free and independent press in fostering democracy, promoting transparency, and upholding the principles of human rights,"" the PCO said. ""We honor the brave journalists who risk their lives every day to bring us the news and the stories that shape our world.""
The PCO condemned all attacks on press freedom and called for the protection of journalists and media workers worldwide.
""We believe that a vibrant and independent press is crucial for a healthy democracy, and we will continue to work towards ensuring the freedom of the press is protected and respected in our country,"" the PCO said.
Last week at the 50th anniversary of the Kapisanan ng mga Brodkaster ng Pilipinas (KBP), President Ferdinand R. Marcos Jr. vowed to continue working “hand-in-hand” with the media to strengthen press freedom, assuring media practitioners of the state’s continued commitment to protecting them and their rights in the practice of their profession.
He also committed to “work hard” to “climb our way up” in the global press freedom rankings.
In his speech, the President cited the media’s “instrumental role” in informing the citizenry, shaping public opinion, and “even triggering social mobilization and change.”
The chief executive then urged the press to “lead and foster public discussion, truth and credibility, the rule of law, especially in the practice of broadcasting, news reporting and information-dissemination.”
Marcos also credited KBP for fully establishing itself as an “institution of national significance” and for being an “efficient instrument of public service in Philippine society.” (PNA)
 
"
37,"PBBM orders gov’t agencies, LGUs to back program vs. criminality",,,"President Ferdinand R. Marcos Jr. (File photo)
MANILA – President Ferdinand R. Marcos Jr. has signed a memorandum circular directing all government agencies and encouraging local government units to support the 2023 National Crime Prevention Program (NCPP).
Under Memorandum Circular No. 19, signed by the President on Tuesday, the directive is in line with the adoption of a “whole-of-government” approach in addressing criminality, and ensuring peace and security in the country.
The 2023 NCPP “operationalizes the strategies for ensuring peace and security under the Philippine Development Plan 2023-2028” with the National Police Commission (Napolcom) at the helm of NCPP implementation.
The 2023 NCPP was developed by Napolcom through its Technical Committee on Crime Prevention and Criminal Justice, an inter-disciplinary body composed of acknowledged experts from government agencies and non-government organizations involved in the criminal justice system.
Napolcom is an agency attached to the Department of the Interior and Local Government (DILG) responsible for the administration and control of the Philippine National Police. (PND)
"
38,PBBM OKs inter-agency body for 125th PH independence anniversary,,,"File photo
MANILA – President Ferdinand R. Marcos Jr. has signed an administrative order creating an inter-agency committee for the commemoration of the 125th anniversary of Philippine independence and nationhood.
Marcos signed Administrative Order No. 8 on Tuesday, tasking the committee to “facilitate the planning and execution of programs and projects” for the commemoration of the 125th Philippine independence anniversary.
The committee will be chaired by the National Historical Commission of the Philippines (NHCP) with the Department of the Interior and Local Government (DILG) as vice chair.
The inter-agency committee’s members are the Department of Tourism, Department of Education, Department of National Defense, Department of Information and Communications Technology, Department of Trade and Industry, Department of Budget and Management, Department of Labor and Employment, Department of Transportation, and the Metro Manila Development Authority.
The country will commemorate the 125th anniversary of Philippine independence from 2023 to 2026 to “give focus on the freedom that our forebearers struggled for towards that they dreamed for the country and the history that we seek to remember and honor them with.”
Republic Act No. 10086, or the “Strengthening Peoples’ Nationalism Through Philippine History Act” provides that the State shall provide the means to “strengthen people's nationalism, love of country, respect for its heroes and pride for the people's accomplishments by reinforcing the importance of Philippine national and local history in daily life with the end in view of raising social consciousness.”
It is further directed to ""reinvigorate government support for historical research; and sustaining and enhancing programs for the protection, preservation and conservation of historical relics and memorabilia, monuments, sites and other historical resources.” (PND)
"
