,Statement,Link,Date
1675,Initial recommendations on 118 PNP resignations to be submitted to NAPOLCOM —Azurin,https://www.gmanetwork.com/news/topstories/nation/862155/initial-recommendations-on-118-pnp-resignations-to-be-submitted-to-napolcom-azurin/story/,"Feb 27, 2023"
1676,PCG joins search for missing Taiwanese vessel,https://www.gmanetwork.com/news/topstories/nation/862151/pcg-joins-search-for-missing-taiwanese-vessel/story/,"Feb 27, 2023"
1677,"Marcos: Continuing Kadiwa stalls answer to food crisis, high prices of commodities",https://www.gmanetwork.com/news/topstories/nation/862144/marcos-continuing-kadiwa-stalls-answer-to-food-crisis-high-prices-of-commodities/story/,"Feb 27, 2023"
1678,"Significant rise in COVID-19 positivity rate seen in South Cotabato, Misamis Oriental —OCTA",https://www.gmanetwork.com/news/topstories/nation/862134/significant-rise-in-covid-19-positivity-rate-seen-in-south-cotabato-misamis-oriental-octa/story/,"Feb 27, 2023"
1679,Malaysia PM Anwar to visit Philippines on March 1 –officials,https://www.gmanetwork.com/news/topstories/nation/862130/malaysia-pm-anwar-to-visit-philippines-on-march-1-officials/story/,"Feb 27, 2023"
1680,"Military recovers mines, ammo after Albay encounter with alleged NPA rebels",https://www.gmanetwork.com/news/topstories/nation/862109/military-recovers-mines-ammo-after-albay-encounter-with-alleged-npa-rebels/story/,"Feb 26, 2023"
1681,Pimentel urges GSIS: Let public servants serving less than 15 years retire with pension,https://www.gmanetwork.com/news/topstories/nation/862101/pimentel-urges-gsis-let-public-servants-serving-less-than-15-years-retire-with-pension/story/,"Feb 26, 2023"
1682,Nationwide earthquake drill for the ‘Big One’ set on March 9 –OCD,https://www.gmanetwork.com/news/topstories/nation/862094/nationwide-earthquake-drill-for-the-big-one-set-on-march-9-ocd/story/,"Feb 26, 2023"
1683,Bill institutionalizing transition to e-governance approved by House committee,https://www.gmanetwork.com/news/topstories/nation/862092/bill-institutionalizing-transition-to-e-governance-approved-by-house-committee/story/,"Feb 26, 2023"
1684,PCG sees additional 4K personnel by end of 2023,https://www.gmanetwork.com/news/topstories/nation/862046/pcg-sees-additional-4k-personnel-by-end-of-2023/story/,"Feb 25, 2023"
1685,Philippines posts 142 new COVID-19 cases,https://www.gmanetwork.com/news/topstories/nation/862038/philippines-posts-142-new-covid-19-cases/story/,"Feb 25, 2023"
1686,"BOC seizes P104M worth of illegally imported onions, sugar, cigarettes",https://www.gmanetwork.com/news/topstories/nation/862022/boc-seizes-over-p104m-worth-of-illegally-imported-onions-sugar-cigarettes/story/,"Feb 25, 2023"
1687,DOJ's Remulla: We will investigate drug war killings on our own,https://www.gmanetwork.com/news/topstories/nation/862017/doj-s-remulla-we-will-investigate-drug-war-killings-on-our-own/story/,"Feb 25, 2023"
1688,"PCG: Chinese militia, coastguard ships still in Ayungin, Sabina Shoals",https://www.gmanetwork.com/news/topstories/nation/862004/pcg-chinese-militia-coastguard-ships-still-in-ayungin-sabina-shoals/story/,"Feb 25, 2023"
1689,37th EDSA People Power Revolution Anniversary remembered in simple ceremony,https://www.gmanetwork.com/news/topstories/nation/861998/37th-edsa-people-power-revolution-anniversary-remembered-in-simple-ceremony/story/,"Feb 25, 2023"
1690,Marcos offers 'hand of reconciliation' on 37th EDSA People Power anniversary,https://www.gmanetwork.com/news/topstories/nation/861993/marcos-offers-hand-of-reconciliation-on-37th-edsa-people-power-anniversary/story/,"Feb 25, 2023"
1691,"Sara Duterte thanks Eagles for philanthropy, takes oath as member",https://www.gmanetwork.com/news/topstories/nation/861972/sara-duterte-thanks-eagles-for-philanthropy-takes-oath-as-member/story/,"Feb 24, 2023"
1692,"BFAR, PAMALAKAYA discuss Manila Bay dredging, reclamation activities",https://www.gmanetwork.com/news/topstories/nation/861958/bfar-pamalakaya-discuss-manila-bay-dredging-reclamation-activities/story/,"Feb 24, 2023"
1693,Nancy Binay seeks probe into BuCor's transfer plan to Masungi Georeserve,https://www.gmanetwork.com/news/topstories/nation/861954/nancy-binay-seeks-probe-into-bucor-s-transfer-plan-to-masungi-georeserve/story/,"Feb 24, 2023"
1694,PNP informants receive around P8M for arrest of most wanted persons,https://www.gmanetwork.com/news/topstories/nation/861947/pnp-informants-receive-around-p8m-for-arrest-of-most-wanted-persons/story/,"Feb 24, 2023"
1695,"DOJ, UPPAF sign MOU for competition reform",https://www.gmanetwork.com/news/topstories/nation/861938/doj-uppaf-sign-mou-for-competition-reform/story/,"Feb 24, 2023"
1696,"De Lima files motion for case dismissal, immediate release",https://www.gmanetwork.com/news/topstories/nation/861927/de-lima-files-motion-for-case-dismissal-immediate-release/story/,"Feb 24, 2023"
1697,"DOJ eyes no settlement in incestuous rape, child abuse cases",https://www.gmanetwork.com/news/topstories/nation/861923/doj-eyes-no-settlement-in-incestuous-rape-child-abuse-cases/story/,"Feb 24, 2023"
1698,PNP checking for 'pattern' in series of attacks vs. local officials —Azurin,https://www.gmanetwork.com/news/topstories/nation/861916/pnp-checking-for-pattern-in-series-of-attacks-vs-local-officials-azurin/story/,"Feb 24, 2023"
1699,Zubiri on EDSA People Power anniversary: Learn lessons of the past regardless of political color,https://www.gmanetwork.com/news/topstories/nation/861909/zubiri-on-edsa-people-power-anniversary-learn-lessons-of-the-past-regardless-of-political-color/story/,"Feb 24, 2023"
1700,Bato dela Rosa believes Marcos has no secret order to push Cha-cha in Congress,https://www.gmanetwork.com/news/topstories/nation/861895/bato-dela-rosa-believes-marcos-has-no-secret-order-to-push-cha-cha-in-congress/story/,"Feb 24, 2023"
1701,SC disbars lawyer over claims of bribing justices,https://www.gmanetwork.com/news/topstories/nation/861889/sc-disbars-lawyer-over-claims-of-bribing-justices/story/,"Feb 24, 2023"
1702,Chinese Coast Guard tries to shoo away PCG vessel in Ayungin Shoal,https://www.gmanetwork.com/news/topstories/nation/861877/chinese-coast-guard-tries-to-shoo-away-pcg-vessel-in-ayungin-shoal/story/,"Feb 24, 2023"
1703,Philippines lost at least half of mangrove areas from 1918 to 2010,https://www.gmanetwork.com/news/topstories/nation/861868/philippines-lost-at-least-half-of-mangrove-areas-from-1918-to-2010/story/,"Feb 24, 2023"
1704,Divorce bills OKd 'in principle' by House panel,https://www.gmanetwork.com/news/topstories/nation/861854/divorce-bills-okd-in-principle-by-house-panel/story/,"Feb 23, 2023"
1705,Will reclamation projects mean goodbye to Manila Bay's sunset view?,https://www.gmanetwork.com/news/topstories/nation/861848/will-the-reclamation-projects-mean-goodbye-to-manila-bay-s-sunset-view/story/,"Feb 23, 2023"
1706,"DOH reports 150 new COVID-19 cases; active tally at 9,269",https://www.gmanetwork.com/news/topstories/nation/861831/doh-reports-150-new-covid-19-cases-active-tally-at-9-269/story/,"Feb 23, 2023"
1707,Remulla: ICC talk with EU MPs lasted less than three minutes,https://www.gmanetwork.com/news/topstories/nation/861826/remulla-icc-talk-with-eu-mps-lasted-less-than-three-minutes/story/,"Feb 23, 2023"
1708,EU MPs visit De Lima on eve of 6th anniversary in detention,https://www.gmanetwork.com/news/topstories/nation/861820/eu-mps-visit-de-lima-on-eve-of-6th-anniversary-in-detention/story/,"Feb 23, 2023"
1709,"Agri products supplier in Enrile graft case has no license, says witness",https://www.gmanetwork.com/news/topstories/nation/861812/agri-products-supplier-in-enrile-graft-case-has-no-license-says-witness/story/,"Feb 23, 2023"
1710,Hontiveros floats possible charges vs. Panganiban over alleged 'government-sponsored' sugar smuggling,https://www.gmanetwork.com/news/topstories/nation/861794/hontiveros-floats-possible-charges-vs-panganiban-over-government-sponsored-sugar-smuggling/story/,"Feb 23, 2023"
1711,"PH Commission on Women backs divorce bills, says current system disadvantageous to women",https://www.gmanetwork.com/news/topstories/nation/861781/ph-commission-on-women-backs-divorce-bills-says-current-system-disadvantageous-to-women/story/,"Feb 23, 2023"
1712,Bato wants party-list system abolished,https://www.gmanetwork.com/news/topstories/nation/861768/bato-wants-party-list-abolished/story/,"Feb 23, 2023"
1713,17 PH provinces among top at-risk areas for climate damage —report,https://www.gmanetwork.com/news/topstories/nation/861738/17-philippine-regions-among-top-at-risk-areas-for-climate-damage-report/story/,"Feb 23, 2023"
1714,Australian deputy prime minister pay courtesy call on VP Sara Duterte,https://www.gmanetwork.com/news/topstories/nation/861729/australian-deputy-prime-minister-pay-courtesy-call-on-vp-sara-duterte/story/,"Feb 22, 2023"
1715,Jinggoy Estrada calls ICC probers 'white monkeys'; tells them to back off,https://www.gmanetwork.com/news/topstories/nation/861721/jinggoy-estrada-calls-icc-probers-white-monkeys/story/,"Feb 22, 2023"
1716,Erwin Tulfo eyed as nominee after ACT-CIS solon quits —House sources,https://www.gmanetwork.com/news/topstories/nation/861708/erwin-tulfo-eyed-as-nominee-after-act-cis-solon-quits-house-sources/story/,"Feb 22, 2023"
1717,"DOH logs 86 new COVID-19 cases; active tally hits 9,203",https://www.gmanetwork.com/news/topstories/nation/861705/doh-logs-86-new-covid-19-cases-active-tally-hits-9-203/story/,"Feb 22, 2023"
1718,Charter change resolution reaches House plenary,https://www.gmanetwork.com/news/topstories/nation/861694/charter-change-resolution-reaches-house-plenary/story/,"Feb 22, 2023"
1719,"Ejercito suggests command center, scanning system for PNP checkpoints",https://www.gmanetwork.com/news/topstories/nation/861681/ejercito-suggests-command-center-scanning-system-for-pnp-checkpoints/story/,"Feb 22, 2023"
1720,Marcos orders revision of scientific career system IRR,https://www.gmanetwork.com/news/topstories/nation/861679/marcos-orders-revision-of-scientific-career-system-irr/story/,"Feb 22, 2023"
1721,"Sandiganbayan junks ill-gotten wealth case on behest loans vs. Marcos Sr., others",https://www.gmanetwork.com/news/topstories/nation/861650/sandiganbayan-junks-ill-gotten-wealth-case-on-behest-loans-vs-marcos-sr-others/story/,"Feb 22, 2023"
1722,Korean ambassador asks PH to deport 3 nationals,https://www.gmanetwork.com/news/topstories/nation/861665/korean-ambassador-asks-ph-to-deport-3-nationals/story/,"Feb 22, 2023"
1723,"CA OKs appointments of PH envoy to New Zealand, 14 DFA execs",https://www.gmanetwork.com/news/topstories/nation/861661/ca-oks-appointments-of-ph-envoy-to-new-zealand-14-dfa-execs/story/,"Feb 22, 2023"
1724,"Talk on ICC probe vs. Duterte's drug war 'constructive, fruitful’ — Tolentino, Neumann",https://www.gmanetwork.com/news/topstories/nation/861646/ph-senators-eu-mps-had-constructive-fruitful-talk-on-icc-probe-vs-duterte-s-drug-war/story/,"Feb 22, 2023"
1725,Marcos prays for nation's 'quiet reflection' as Filipinos observe Ash Wednesday,https://www.gmanetwork.com/news/topstories/nation/861636/marcos-prays-for-nation-s-quiet-reflection-as-filipinos-observe-ash-wednesday/story/,"Feb 22, 2023"
1726,Sara Duterte to town mayors: Don’t meddle in appointment of teachers,https://www.gmanetwork.com/news/topstories/nation/861615/sara-duterte-to-town-mayors-don-t-meddle-in-appointment-of-teachers/story/,"Feb 22, 2023"
1727,Newlywed couple gives 'gold bars' as wedding souvenirs,https://www.gmanetwork.com/news/topstories/nation/861605/newlywed-couple-gives-gold-bars-as-wedding-souvenirs/story/,"Feb 21, 2023"
1728,Philippines detects 56 additional cases of Omicron subvariants,https://www.gmanetwork.com/news/topstories/nation/861601/philippines-detects-56-additional-cases-of-omicron-subvariants/story/,"Feb 21, 2023"
1729,"LTFRB sets traditional jeeps' final trips on June 30, 2023",https://www.gmanetwork.com/news/topstories/nation/861594/ltfrb-sets-traditional-jeeps-final-trips-on-june-30-2023/story/,"Feb 21, 2023"
1730,Comelec names Brian Yamsuan as first nominee of Bicol Saro party-list,https://www.gmanetwork.com/news/topstories/nation/861590/comelec-names-brian-yamsuan-as-first-nominee-of-bicol-saro-party-list/story/,"Feb 21, 2023"
1731,"DOH: Summit held to develop roadmap, expand genomic surveillance",https://www.gmanetwork.com/news/topstories/nation/861579/doh-summit-held-to-develop-roadmap-expand-genomic-surveillance/story/,"Feb 21, 2023"
1732,Jinggoy Estrada wants Optical Media Board abolished,https://www.gmanetwork.com/news/topstories/nation/861574/estrada-wants-optical-media-board-abolished/story/,"Feb 21, 2023"
1733,"DOH posts 82 new COVID-19 cases, active tally climbs to 9,211",https://www.gmanetwork.com/news/topstories/nation/861570/doh-posts-82-new-covid-19-cases-active-tally-climbs-to-9-211/story/,"Feb 21, 2023"
1734,Tolentino to take up ICC investigation vs. Duterte with EU MPs,https://www.gmanetwork.com/news/topstories/nation/861561/tolentino-to-take-up-icc-investigation-vs-duterte-with-eu-mps/story/,"Feb 21, 2023"
1735,BI arrests Sudanese wanted for alleged human organ trafficking,https://www.gmanetwork.com/news/topstories/nation/861559/bi-arrests-sudanese-wanted-for-alleged-human-organ-trafficking/story/,"Feb 21, 2023"
1736,Tulfo suggests processing center for private planes amid alleged human smuggling,https://www.gmanetwork.com/news/topstories/nation/861547/tulfo-suggests-processing-center-for-private-planes-amid-alleged-human-smuggling/story/,"Feb 21, 2023"
1737,Remulla questions why ICC was not probing drug cartels instead,https://www.gmanetwork.com/news/topstories/nation/861533/remulla-questions-why-icc-was-not-probing-drug-cartels-instead/story/,"Feb 21, 2023"
1738,"Marcos names Isidro Purisima as acting Presidential Peace, Reconciliation, and Unity adviser",https://www.gmanetwork.com/news/topstories/nation/861528/marcos-names-isidro-purisima-as-acting-presidential-peace-reconciliation-and-unity-adviser/story/,"Feb 21, 2023"
1739,House pushing for con-con to gain public trust - panel exec,https://www.gmanetwork.com/news/topstories/nation/861521/house-pushing-for-con-con-to-gain-public-trust-panel-exec/story/,"Feb 21, 2023"
1740,DICT says over 34M SIM already registered with telcos,https://www.gmanetwork.com/news/topstories/nation/861517/dict-says-over-34m-sims-already-registered-with-telcos/story/,"Feb 21, 2023"
1741,"Flex Fuel denies involvement in investment scam, willing to work with authorities",https://www.gmanetwork.com/news/topstories/nation/861509/flex-fuel-denies-involvement-in-investment-scam-willing-to-work-with-authorities/story/,"Feb 21, 2023"
1742,"Comelec eyes filing of COC for barangay, SK elections in first week of July",https://www.gmanetwork.com/news/topstories/nation/861498/comelec-eyes-filing-of-coc-for-barangay-sk-elections-in-first-week-of-july/story/,"Feb 21, 2023"
1743,Estrada files Senate resolution opposing ICC drug war probe,https://www.gmanetwork.com/news/topstories/nation/861485/estrada-files-senate-resolution-opposing-icc-drug-war-probe/story/,"Feb 21, 2023"
1744,Remulla orders reduced bail bond for poor prisoners,https://www.gmanetwork.com/news/topstories/nation/861471/remulla-orders-reduced-bail-bond-for-poor-prisoners/story/,"Feb 21, 2023"
1745,"PH at military AI summit:  Peace, security requires more control, humanity",https://www.gmanetwork.com/news/topstories/nation/861467/philippines-at-military-ai-summit-peace-security-requires-more-control-humanity/story/,"Feb 21, 2023"
1746,Senate employees get P50K 'inflationary allowance'; group says 'sana all',https://www.gmanetwork.com/news/topstories/nation/861462/senate-employees-get-p50k-inflationary-allowance-group-says-sana-all/story/,"Feb 20, 2023"
1747,Philippine USAR team to head home after 2 weeks of search and rescue in Turkey,https://www.gmanetwork.com/news/topstories/nation/861449/philippine-usar-team-to-head-home-after-2-weeks-of-search-and-rescue-in-turkey/story/,"Feb 20, 2023"
1748,PH logs 113 new COVID-19 cases,https://www.gmanetwork.com/news/topstories/nation/861439/ph-logs-113-new-covid-19-cases/story/,"Feb 20, 2023"
1749,Marcos reminds sworn in execs that gov't efforts in vain if people don't benefit,https://www.gmanetwork.com/news/topstories/nation/861426/marcos-reminds-sworn-in-execs-that-gov-t-efforts-in-vain-if-people-don-t-benefit/story/,"Feb 20, 2023"
1750,DepEd: P155-k DSLR camera given by LGU to Imus schools division office,https://www.gmanetwork.com/news/topstories/nation/861429/deped-p155-k-dslr-camera-given-by-lgu-to-imus-schools-division-office/story/,"Feb 20, 2023"
1751,House panel OKs bill expanding foreign aid fund sources,https://www.gmanetwork.com/news/topstories/nation/861423/house-panel-oks-bill-expanding-foreign-aid-fund-sources/story/,"Feb 20, 2023"
1752,DepEd welcomes arrest of suspect allegedly involved in 'position for sale' scam,https://www.gmanetwork.com/news/topstories/nation/861417/deped-probes-employee-allegedly-involved-in-position-for-sale-scam/story/,"Feb 20, 2023"
1753,House panel okays VAT refund for tourists,https://www.gmanetwork.com/news/topstories/nation/861413/house-panel-okays-vat-refund-for-tourists/story/,"Feb 20, 2023"
1754,PhilHealth seeks more funding for mental health services for children,https://www.gmanetwork.com/news/topstories/nation/861406/philhealth-seeks-more-funding-for-mental-health-services-for-children/story/,"Feb 20, 2023"
1755,Remulla says no objection to bail plea as De Lima nears 6 years in detention,https://www.gmanetwork.com/news/topstories/nation/861405/remulla-says-no-objection-to-bail-plea-as-de-lima-nears-6-years-in-detention/story/,"Feb 20, 2023"
1756,Remulla says BuCor HQ at Masungi Georeserve not final yet,https://www.gmanetwork.com/news/topstories/nation/861401/remulla-says-bucor-hq-at-masungi-georeserve-not-final-yet/story/,"Feb 20, 2023"
1757,Suspects in Aparri vice mayor ambush reportedly wore police uniforms —PNP,https://www.gmanetwork.com/news/topstories/nation/861393/suspects-in-aparri-vice-mayor-ambush-reportedly-wore-police-uniforms/story/,"Feb 20, 2023"
1758,NCR COVID-19 positivity rate rose slightly to 1.7% —OCTA,https://www.gmanetwork.com/news/topstories/nation/861386/ncr-covid-19-positivity-rate-rose-slightly-to-1-7-octa/story/,"Feb 20, 2023"
1759,"Burned bodies found in Nasugbu, Batangas",https://www.gmanetwork.com/news/topstories/nation/861344/burned-bodies-found-in-nasugbu-batangas/story/,"Feb 19, 2023"
1760,Palace assails 'salary deduction' memo to raise fund for Turkey,https://www.gmanetwork.com/news/topstories/nation/861334/palace-assails-salary-deduction-memo-to-raise-fund-for-turkey/story/,"Feb 19, 2023"
1761,"IPU committee renews call for de Lima release, to continue monitoring trial",https://www.gmanetwork.com/news/topstories/nation/861324/ipu-committee-renews-call-for-de-lima-release-to-continue-monitoring-trial/story/,"Feb 19, 2023"
1762,Marcos: Laws on responsible mining will continue to be enforced,https://www.gmanetwork.com/news/topstories/nation/861289/marcos-laws-on-responsible-mining-will-continue-to-be-enforced/story/,"Feb 18, 2023"
1763,Authorities seize P100 million in allegedly smuggled agricultural products,https://www.gmanetwork.com/news/topstories/nation/861277/authorities-seize-p100-million-in-allegedly-smuggled-agricultural-products/story/,"Feb 18, 2023"
1764,No studies on sources of funding for Maharlika — Escudero,https://www.gmanetwork.com/news/topstories/nation/861276/no-studies-on-sources-of-funding-for-maharlika-escudero/story/,"Feb 18, 2023"
1765,"Cancer now treatable, but more gov’t funds needed for testing - oncology specialist",https://www.gmanetwork.com/news/topstories/nation/861264/cancer-now-treatable-but-more-gov-t-funds-needed-for-testing-oncology-specialist/story/,"Feb 18, 2023"
1766,"Marcos won’t cooperate with ICC over sovereignty, jurisdictional issues",https://www.gmanetwork.com/news/topstories/nation/861256/marcos-won-t-cooperate-with-icc-over-sovereignty-jurisdictional-issues/story/,"Feb 18, 2023"
1767,"Marcos: Laser-pointing incident partly escalatory, invoking MDT unnecessary",https://www.gmanetwork.com/news/topstories/nation/861254/marcos-laser-pointing-incident-partly-escalatory-invoking-mdt-unnecessary/story/,"Feb 18, 2023"
1768,Marcos: This country will not lose one inch of its territory,https://www.gmanetwork.com/news/topstories/nation/861235/marcos-this-country-will-not-lose-one-inch-of-its-territory/story/,"Feb 18, 2023"
1769,Navy seizes oil tanker carrying P50 million in alleged smuggled fuel,https://www.gmanetwork.com/news/topstories/nation/861199/navy-seizes-oil-tanker-carrying-p50-million-in-alleged-smuggled-fuel/story/,"Feb 17, 2023"
1770,Budget chief Pangandman stands firm in support for PS-DBM,https://www.gmanetwork.com/news/topstories/nation/861194/budget-chief-pangandman-stands-firm-in-support-for-ps-dbm/story/,"Feb 17, 2023"
1771,"Huang: Both PH, China need to stop 'provocative action in disputed area'",https://www.gmanetwork.com/news/topstories/nation/861184/huang-both-ph-china-need-to-stop-provocative-action-in-disputed-area/story/,"Feb 17, 2023"
1772,PH could lose COVID-19 vaccine donations as health emergency ends –solon,https://www.gmanetwork.com/news/topstories/nation/869260/ph-could-lose-covid-19-vaccine-donations-as-health-emergency-ends-solon/story/,"May 07, 2023"
1773,PH tells China to respect its rights after near-crash in WPS,https://www.gmanetwork.com/news/topstories/nation/868408/philippines-tells-china-to-respect-its-rights-in-west-philippine-sea-after-near-crash/story/,"Apr 28, 2023"
1774,DA developing plan to promote planting of hybrid rice seeds,https://www.gmanetwork.com/news/topstories/nation/861182/da-developing-plan-to-promote-planting-of-hybrid-rice-seeds/story/,"Feb 17, 2023"
1775,Police release wanted poster of six suspects behind missing ‘sabungeros’ in Manila Arena,https://www.gmanetwork.com/news/topstories/nation/861171/police-release-wanted-poster-of-six-suspects-behind-missing-sabungeros-in-manila-arena/story/,"Feb 17, 2023"
1776,BuCor eyes new HQ at Masungi Georeserve; Masungi alarmed,https://www.gmanetwork.com/news/topstories/nation/861158/bucor-eyes-new-hq-at-masungi-georeserve-masungi-alarmed/story/,"Feb 17, 2023"
1777,PH says China destabilizing peace in West Philippine Sea,https://www.gmanetwork.com/news/topstories/nation/861151/dfa-china-destabilizing-peace-in-west-philippine-sea/story/,"Feb 17, 2023"
1778,PSA: Over 22M ePhilIDs issued so far,https://www.gmanetwork.com/news/topstories/nation/861143/psa-over-22m-ephilids-issued-so-far/story/,"Feb 17, 2023"
1779,PCG strengthens operations in West Philippines Sea,https://www.gmanetwork.com/news/topstories/nation/861133/pcg-strengthens-operations-in-west-philippines-sea/story/,"Feb 17, 2023"
1780,DSWD warns vs. scammers preying on seniors,https://www.gmanetwork.com/news/topstories/nation/861104/dswd-warns-vs-scammers-preying-on-seniors/story/,"Feb 16, 2023"
1781,"Filipino rescuers feed, tend to animals who lost their humans in Turkey quake",https://www.gmanetwork.com/news/topstories/nation/861100/filipino-rescuers-feed-tend-to-animals-who-lost-their-humans-in-turkey-quake/story/,"Feb 16, 2023"
1782,"Ten indicted for kidnap, slay of pharma firm exec",https://www.gmanetwork.com/news/topstories/nation/861082/ten-indicted-for-kidnap-slay-of-pharma-firm-exec/story/,"Feb 16, 2023"
1783,"Robin Padilla wants farmers, fisherfolk to become businessmen",https://www.gmanetwork.com/news/topstories/nation/861069/robin-padilla-wants-farmers-fisherfolk-to-become-businessmen/story/,"Feb 16, 2023"
1784,No need for Philippine rescue team to extend ops in quake-hit Turkey so far — OCD,https://www.gmanetwork.com/news/topstories/nation/861058/no-need-for-philippine-rescue-team-to-extend-ops-in-quake-hit-turkey-so-far-ocd/story/,"Feb 16, 2023"
1785,Philippines intends to give cash donation to quake-hit Syria — OCD,https://www.gmanetwork.com/news/topstories/nation/861045/philippines-intends-to-give-cash-donation-to-quake-hit-syria-ocd/story/,"Feb 16, 2023"
1786,UHC law can’t be applied retroactively —DOJ,https://www.gmanetwork.com/news/topstories/nation/861035/uhc-law-can-t-be-applied-retroactively-doj/story/,"Feb 16, 2023"
1787,"Poe wants MIA, BI in Senate probe on alleged human trafficking modus in NAIA",https://www.gmanetwork.com/news/topstories/nation/861024/poe-wants-mia-bi-in-senate-probe-on-alleged-human-trafficking-modus-in-naia/story/,"Feb 16, 2023"
1788,"Gloria Arroyo, other solons rally behind Duterte amid ICC drug war probe",https://www.gmanetwork.com/news/topstories/nation/861021/gloria-arroyo-other-solons-rally-behind-duterte-amid-icc-drug-war-probe/story/,"Feb 16, 2023"
1789,Imee insists RCEP will kill local agri industry despite President's push for ratification,https://www.gmanetwork.com/news/topstories/nation/861017/imee-insists-rcep-will-kill-local-agri-industry-despite-president-s-push-for-ratification/story/,"Feb 16, 2023"
1790,Hontiveros seeks justification on issuance of latest sugar order,https://www.gmanetwork.com/news/topstories/nation/861011/hontiveros-seeks-justification-on-issuance-of-latest-sugar-order/story/,"Feb 16, 2023"
1791,"Chinese envoy, AFP chief meet amid laser controversy",https://www.gmanetwork.com/news/topstories/nation/860996/chinese-envoy-afp-chief-meet-amid-laser-pointing-incident/story/,"Feb 16, 2023"
1792,"China says lasers for ‘navigation safety’, denies pointing at PH crew",https://www.gmanetwork.com/news/topstories/nation/860985/china-says-lasers-for-navigation-safety-denies-pointing-at-philippine-crew/story/,"Feb 16, 2023"
1793,NKTI proposes lifetime support for dialysis patients,https://www.gmanetwork.com/news/topstories/nation/860969/nkti-proposes-lifetime-support-for-dialysis-patients/story/,"Feb 15, 2023"
