,Statement,Link,Date
480,ACT proposes 185 class days yearly for return of summer school break,https://www.gmanetwork.com/news/topstories/nation/866574/act-proposes-185-class-days-yearly-for-return-of-summer-school-break/story/,"Apr 11, 2023"
481,"PH, US kick off 2023 Balikatan military exercise",https://www.gmanetwork.com/news/topstories/nation/866568/ph-us-kick-off-2023-balikatan-military-exercise/story/,"Apr 11, 2023"
482,"DOLE to hold job fair, provide gov’t aid on Labor Day",https://www.gmanetwork.com/news/topstories/nation/866560/dole-to-hold-job-fair-provide-gov-t-aid-on-labor-day/story/,"Apr 11, 2023"
483,Result of probe on construction of MT Princess Empress may be out this month —MARINA,https://www.gmanetwork.com/news/topstories/nation/866556/result-of-probe-on-construction-of-mt-princess-empress-may-be-out-this-month-marina/story/,"Apr 11, 2023"
484,"PDEG chief Domingo, 9 others to go on leave over P6.7-B shabu case",https://www.gmanetwork.com/news/topstories/nation/866545/10-police-officers-to-go-on-leave-over-p6-7-b-shabu-case-pdeg-chief-domingo/story/,"Apr 11, 2023"
485,Discussion needed on how US can use Philippines bases — DFA chief,https://www.gmanetwork.com/news/topstories/nation/866521/philippines-minister-urges-us-china-to-manage-rivalry-with-dialogue/story/,"Apr 11, 2023"
486,China on Balikatan: US-PH cooperation must not interfere in sea dispute,https://www.gmanetwork.com/news/topstories/nation/866510/china-on-balikatan-us-ph-cooperation-must-not-interfere-in-south-china-sea-dispute/story/,"Apr 10, 2023"
487,Boats off north Luzon suggest Chinese interest in Luzon Strait –security expert,https://www.gmanetwork.com/news/topstories/nation/866499/boats-off-north-luzon-suggest-chinese-interest-in-luzon-strait-security-expert/story/,"Apr 10, 2023"
488,Poe laments ‘drought of common goals’ amid looming water crisis,https://www.gmanetwork.com/news/topstories/nation/866492/poe-laments-drought-of-common-goals-amid-looming-water-crisis/story/,"Apr 10, 2023"
489,"BI: 45,000 arrivals recorded on Easter Sunday",https://www.gmanetwork.com/news/topstories/nation/866494/bi-45-000-arrivals-recorded-on-easter-sunday/story/,"Apr 10, 2023"
490,"PCG: 70,535 outbound, 55,151 inbound travelers on April 10",https://www.gmanetwork.com/news/topstories/nation/866479/pcg-70-535-outbound-55-151-inbound-travelers-on-april-10/story/,"Apr 10, 2023"
491,DND sets budget for ROTC uniforms at P5 billion –Dela Rosa,https://www.gmanetwork.com/news/topstories/nation/866475/dnd-sets-budget-for-rotc-uniforms-at-p5-billion-dela-rosa/story/,"Apr 10, 2023"
492,"Philippines, US to test ‘combat-ready’ force in biggest Balikatan exercise",https://www.gmanetwork.com/news/topstories/nation/866463/philippine-us-to-test-combat-ready-force-in-biggest-balikatan-exercise/story/,"Apr 10, 2023"
493,Marcos on his Holy Week: Good time to take a breath,https://www.gmanetwork.com/news/topstories/nation/866461/marcos-on-his-holy-week-good-time-to-take-a-breath/story/,"Apr 10, 2023"
494,Marcos wants pension system for war veterans fixed,https://www.gmanetwork.com/news/topstories/nation/866456/marcos-wants-pension-system-for-war-veterans-fixed/story/,"Apr 10, 2023"
495,PCG: Over 31K passengers monitored on last morning of long weekend,https://www.gmanetwork.com/news/topstories/nation/866449/pcg-over-31k-passengers-monitored-on-last-morning-of-long-weekend/story/,"Apr 10, 2023"
496,NCR COVID-19 positivity rate breaches 5% mark —OCTA,https://www.gmanetwork.com/news/topstories/nation/866447/ncr-covid-19-positivity-rate-breaches-5-mark-octa/story/,"Apr 10, 2023"
497,Batangas Port sees influx of returning Holy Week vacationers,https://www.gmanetwork.com/news/topstories/nation/866427/batangas-port-sees-influx-of-returning-holy-week-vacationers/story/,"Apr 09, 2023"
498,Sara urges fight vs. social ills on Araw ng Kagitingan,https://www.gmanetwork.com/news/topstories/nation/866393/sara-urges-fight-vs-social-ills-on-araw-ng-kagitingan/story/,"Apr 09, 2023"
499,Marcos urges speaking up vs. discrimination on Araw ng Kagitingan,https://www.gmanetwork.com/news/topstories/nation/866380/marcos-urges-speaking-up-vs-discrimination-on-araw-ng-kagitingan/story/,"Apr 09, 2023"
500,"PCG logs over 73K outbound, 49K inbound passengers on Black Saturday",https://www.gmanetwork.com/news/topstories/nation/866373/pcg-logs-over-73k-outbound-49k-inbound-passengers-on-black-saturday/story/,"Apr 08, 2023"
501,Philippines records 274 new COVID-19 cases,https://www.gmanetwork.com/news/topstories/nation/866367/philippines-records-274-new-covid-19-cases/story/,"Apr 08, 2023"
502,Families hit by oil spill get food packs from GMA Kapuso Foundation,https://www.gmanetwork.com/news/topstories/nation/866312/families-hit-by-oil-spill-get-food-packs-from-gma-kapuso-foundation/story/,"Apr 07, 2023"
503,"Philippines logs 350 new COVID-19 cases, active tally at 9,568",https://www.gmanetwork.com/news/topstories/nation/866309/philippines-logs-350-new-covid-19-cases-active-tally-at-9-568/story/,"Apr 07, 2023"
504,More EDCA sites to cost taxpayers' money -Gabriela solon,https://www.gmanetwork.com/news/topstories/nation/866298/more-edca-sites-to-cost-taxpayers-money-gabriela-solon/story/,"Apr 07, 2023"
505,"4 vehicular mishaps, food poisoning case reported so far amid Holy Week –NDRRMC",https://www.gmanetwork.com/news/topstories/nation/866290/4-vehicular-mishaps-food-poisoning-case-reported-so-far-amid-holy-week-ndrrmc/story/,"Apr 07, 2023"
506,Israel's Iron Dome intercepts volley of rockets from Gaza,https://www.gmanetwork.com/news/topstories/nation/866276/israel-s-iron-dome-intercepts-volley-of-rockets-from-gaza/story/,"Apr 07, 2023"
507,"20,000 devotees joined Nazareno motorcade on Good Friday, says Quiapo Church",https://www.gmanetwork.com/news/topstories/nation/866275/20-000-devotees-joined-nazareno-motorcade-on-good-friday-says-quiapo-church/story/,"Apr 07, 2023"
508,Priest washes feet of kin of EJK victims,https://www.gmanetwork.com/news/topstories/nation/866253/priest-washes-feet-of-kin-of-ejk-victims/story/,"Apr 07, 2023"
509,China: New EDCA sites may draw Philippines into Taiwan conflict,https://www.gmanetwork.com/news/topstories/nation/866250/china-new-edca-sites-may-draw-philippines-into-taiwan-conflict/story/,"Apr 06, 2023"
510,"LGBTQ, IP persons among those whose feet washed by Cardinal Advincula",https://www.gmanetwork.com/news/topstories/nation/866235/lgbtq-ip-persons-among-those-whose-feet-washed-by-cardinal-advincula/story/,"Apr 06, 2023"
511,"Cardinal Advincula: All people of God, not just priests, need to be renewed",https://www.gmanetwork.com/news/topstories/nation/866229/cardinal-advincula-all-people-of-god-not-just-priests-need-to-be-renewed/story/,"Apr 06, 2023"
512,"PCG logs 80,874 outbound, 74,039 inbound travelers on Maundy Thursday",https://www.gmanetwork.com/news/topstories/nation/866215/pcg-logs-80-874-outbound-74-039-inbound-travelers-on-maundy-thursday/story/,"Apr 06, 2023"
513,"Traffic build up in parts of NLEX, SLEX on Maundy Thursday afternoon",https://www.gmanetwork.com/news/topstories/nation/866204/traffic-build-up-in-parts-of-nlex-slex-on-maundy-thursday-afternoon/story/,"Apr 06, 2023"
514,"Senate, House, SC, Cabinet get 'very good' satisfaction rating —SWS",https://www.gmanetwork.com/news/topstories/nation/866196/senate-house-sc-cabinet-get-very-good-satisfaction-rating-sws/story/,"Apr 06, 2023"
515,DOH amid hike in COVID-19 cases: No need to stay home if vaccinated,https://www.gmanetwork.com/news/topstories/nation/866161/doh-amid-hike-in-covid-19-cases-no-need-to-stay-home-if-vaccinated/story/,"Apr 05, 2023"
516,No passenger congestion at NAIA on Holy Wednesday —MIAA,https://www.gmanetwork.com/news/topstories/nation/866154/no-passenger-congestion-at-naia-on-holy-wednesday-miaa/story/,"Apr 05, 2023"
517,Group pushes for campaign contribution limits,https://www.gmanetwork.com/news/topstories/nation/866126/group-pushes-for-campaign-contribution-limits/story/,"Apr 05, 2023"
518,Salceda: Eased inflation both good and bad news,https://www.gmanetwork.com/news/topstories/nation/866123/salceda-eased-inflation-both-good-and-bad-news/story/,"Apr 05, 2023"
519,"LRT2, MRT3, PNR offer free rides for Filipino military veterans on April 5, 10 to 12",https://www.gmanetwork.com/news/topstories/nation/866113/lrt2-mrt3-pnr-offer-free-rides-for-filipino-military-veterans-on-april-5-10-to-12/story/,"Apr 05, 2023"
520,BFAR: Fish supply enough despite increased demand during Holy Week,https://www.gmanetwork.com/news/topstories/nation/866107/bfar-fish-supply-enough-despite-increased-demand-during-holy-week/story/,"Apr 05, 2023"
521,South Korea sends aid for oil spill clean-up,https://www.gmanetwork.com/news/topstories/nation/866103/south-korea-sends-aid-for-oil-spill-clean-up/story/,"Apr 05, 2023"
522,Many high-ranking cops involved in P6.7-B shabu case —Abalos,https://www.gmanetwork.com/news/topstories/nation/866093/many-high-ranking-cops-involved-in-p6-7-b-shabu-case-abalos/story/,"Apr 05, 2023"
523,"PH senators discuss harassment in WPS, RCEP with Japan PM Kishida",https://www.gmanetwork.com/news/topstories/nation/866091/ph-senators-discuss-harassment-in-wps-rcep-with-japan-pm-kishida/story/,"Apr 05, 2023"
524,"LTFRB warns PUV operators vs. overloading, overcharging, ‘colorums’",https://www.gmanetwork.com/news/topstories/nation/866089/ltfrb-warns-puv-operators-vs-overloading-overcharging-colorums/story/,"Apr 05, 2023"
525,"Manalo, Galvez to lead PH delegation in dialogue with US",https://www.gmanetwork.com/news/topstories/nation/866081/manalo-galvez-to-lead-ph-delegation-in-dialogue-with-us/story/,"Apr 05, 2023"
526,"New EDCA sites to enhance efforts vs external, internal threats — DND, AFP",https://www.gmanetwork.com/news/topstories/nation/866074/new-edca-sites-to-enhance-efforts-vs-external-internal-threats-dnd-afp/story/,"Apr 05, 2023"
527,DOJ to file charges vs. Arnie Teves ‘very soon’,https://www.gmanetwork.com/news/topstories/nation/866073/doj-to-file-charges-vs-arnie-teves-very-soon/story/,"Apr 05, 2023"
528,"PNP, PDEA destroy P6.7B worth of shabu seized from dismissed cop Mayo",https://www.gmanetwork.com/news/topstories/nation/866067/pnp-pdea-destroy-p6-7b-worth-of-shabu-seized-from-dismissed-cop-mayo/story/,"Apr 05, 2023"
529,"COCOPEA urges Senate, House to defer bicam on bill banning ‘no-exam-no-permit’",https://www.gmanetwork.com/news/topstories/nation/866048/cocopea-urges-senate-house-to-defer-bicam-on-bill-banning-no-exam-no-permit/story/,"Apr 05, 2023"
530,SC ruling shows when rape is consummated,https://www.gmanetwork.com/news/topstories/nation/866032/sc-ruling-shows-when-rape-is-consummated/story/,"Apr 04, 2023"
531,"DOH posts 217 new COVID-19 cases as active infections climb to 9,680",https://www.gmanetwork.com/news/topstories/nation/866014/doh-posts-217-new-covid-19-cases-as-active-infections-climb-to-9-680/story/,"Apr 04, 2023"
532,"Balikatan 2023 seen to boost PH, US forces' coordination, refine tactics",https://www.gmanetwork.com/news/topstories/nation/866009/balikatan-2023-seen-to-boost-ph-us-forces-coordination-refine-tactics/story/,"Apr 04, 2023"
533,DOH asking DOJ for help to transfer NCMH patients facing criminal raps,https://www.gmanetwork.com/news/topstories/nation/866003/doh-asking-doj-for-help-to-transfer-ncmh-patients-facing-criminal-raps/story/,"Apr 04, 2023"
534,Marcos: Rightsizing not aimed at terminating employees but upskilling workforce,https://www.gmanetwork.com/news/topstories/nation/865997/marcos-rightsizing-not-aimed-at-terminating-employees-but-upskilling-workforce/story/,"Apr 04, 2023"
535,DOH records 118 heat exhaustion cases amid warm season,https://www.gmanetwork.com/news/topstories/nation/865996/doh-records-118-heat-exhaustion-cases-amid-warm-season/story/,"Apr 04, 2023"
536,China warns PH-US EDCA base deal ‘endangering regional peace’,https://www.gmanetwork.com/news/topstories/nation/865986/china-warns-philippine-us-base-deal-endangering-regional-peace/story/,"Apr 04, 2023"
537,"NTC orders regional offices to aid NDRRMC, LGUs during Holy Week",https://www.gmanetwork.com/news/topstories/nation/865981/ntc-orders-regional-offices-to-aid-ndrrmc-lgus-during-holy-week/story/,"Apr 04, 2023"
538,NTF-ELCAC: No need for loyalty check on teachers over possible communist links,https://www.gmanetwork.com/news/topstories/nation/865974/ntf-elcac-no-need-for-loyalty-check-on-teachers-over-possible-communist-links/story/,"Apr 04, 2023"
539,MARINA says it found probable cause vs. MT Princess Empress owner,https://www.gmanetwork.com/news/topstories/nation/865975/marina-says-it-found-probable-cause-vs-mt-princess-empress-owner/story/,"Apr 04, 2023"
540,DOH relying on passage of CDC bill for release of donated bivalent jabs,https://www.gmanetwork.com/news/topstories/nation/865972/doh-relying-on-passage-of-cdc-bill-for-release-of-donated-bivalent-jabs/story/,"Apr 04, 2023"
541,"DOH discourages flagellation, crucifixion on Holy Week",https://www.gmanetwork.com/news/topstories/nation/865956/doh-discourages-flagellation-crucifixion-on-holy-week/story/,"Apr 04, 2023"
542,"Pulse Asia: More Pinoys are against Cha-cha, know little about Constitution",https://www.gmanetwork.com/news/topstories/nation/865953/pulse-asia-more-pinoys-are-against-cha-cha-know-little-about-constitution/story/,"Apr 04, 2023"
543,"Teves brothers, Comelec eyed as resource persons in Senate probe into Degamo’s killing — Bato",https://www.gmanetwork.com/news/topstories/nation/865944/teves-brothers-comelec-eyed-resource-persons-in-senate-probe-into-degamo-s-killing-bato/story/,"Apr 04, 2023"
544,Over 100K outbound passengers at the onset of Holy Week —PCG,https://www.gmanetwork.com/news/topstories/nation/865914/over-100k-outbound-passengers-at-the-onset-of-holy-week-pcg/story/,"Apr 04, 2023"
545,Bureau of Customs personnel destroy OFW's toy plane,https://www.gmanetwork.com/news/topstories/nation/865899/bureau-of-customs-personnel-destroy-ofw-s-toy-plane/story/,"Apr 03, 2023"
546,Some farmers throwing away their produce as 'oversupply' affects income,https://www.gmanetwork.com/news/topstories/nation/865895/some-farmers-throwing-away-their-produce-as-oversupply-affects-income/story/,"Apr 03, 2023"
547,Marcos to attend King Charles III’s coronation in London,https://www.gmanetwork.com/news/topstories/nation/865889/marcos-to-attend-king-charles-iii-s-coronation-in-london/story/,"Apr 03, 2023"
548,"New EDCA sites named in Cagayan, Isabela, Palawan",https://www.gmanetwork.com/news/topstories/nation/865877/palace-bares-proposed-additional-edca-sites/story/,"Apr 03, 2023"
549,"House leader seeks review of nursing curriculum, licensure exams amid low passing rate",https://www.gmanetwork.com/news/topstories/nation/865864/house-leader-seeks-review-of-nursing-curriculum-licensure-exams-amid-low-passing-rate/story/,"Apr 03, 2023"
550,Senate defense panel to tackle MUP pension reform bills in May —Estrada,https://www.gmanetwork.com/news/topstories/nation/865862/senate-defense-panel-to-tackle-mup-pension-reform-bills-in-may-estrada/story/,"Apr 03, 2023"
551,PAGCOR urged to file charges vs. officials behind contract with ex-third party POGO auditor,https://www.gmanetwork.com/news/topstories/nation/865849/pagcor-urged-to-file-charges-vs-officials-behind-contract-with-ex-third-party-pogo-auditor/story/,"Apr 03, 2023"
552,Remulla: Teves appears to be the ‘main mastermind’ in Degamo slay,https://www.gmanetwork.com/news/topstories/nation/865838/remulla-teves-appears-to-be-the-main-mastermind-in-degamo-slay/story/,"Apr 03, 2023"
553,DOH issues guidelines for safe Holy Week observance,https://www.gmanetwork.com/news/topstories/nation/865836/doh-issues-guidelines-for-safe-holy-week-observance/story/,"Apr 03, 2023"
554,No credible threat monitored for Holy Week —PNP,https://www.gmanetwork.com/news/topstories/nation/865828/no-credible-threat-monitored-for-holy-week-pnp/story/,"Apr 03, 2023"
555,Counsel of alleged middleman in Degamo slay claims being blocked from meeting client,https://www.gmanetwork.com/news/topstories/nation/865809/counsel-of-alleged-middleman-in-degamo-slay-claims-being-blocked-from-meeting-client/story/,"Apr 02, 2023"
556,"Search, rescue, retrieval ops continue for Basilan ferry fire victims —PCG",https://www.gmanetwork.com/news/topstories/nation/865798/search-rescue-retrieval-ops-continue-for-basilan-ferry-fire-victims-pcg/story/,"Apr 02, 2023"
557,Marcos urges Filipinos to be ‘conveyors of truth’ on Holy Week,https://www.gmanetwork.com/news/topstories/nation/865787/marcos-urges-filipinos-to-be-conveyors-of-truth-on-holy-week/story/,"Apr 02, 2023"
558,UK envoy: Significant shift in anti-drugs drive under Marcos important but rights challenges remain,https://www.gmanetwork.com/news/topstories/nation/865774/uk-envoy-significant-shift-in-anti-drugs-drive-under-marcos-important-but-rights-challenges-remain/story/,"Apr 02, 2023"
559,"PCG, Japanese ship begin ‘bagging' ops to stop leaks from MT Princess Empress",https://www.gmanetwork.com/news/topstories/nation/865764/pcg-japanese-ship-begin-bagging-ops-to-stop-leaks-from-mt-princess-empress/story/,"Apr 02, 2023"
560,"Manila, Batangas ports prepare for influx of Holy Week passengers",https://www.gmanetwork.com/news/topstories/nation/865759/manila-batangas-ports-prepare-for-influx-of-holy-week-passengers/story/,"Apr 01, 2023"
561,Index crimes drop 16% in Q1 2023 — Abalos,https://www.gmanetwork.com/news/topstories/nation/865754/index-crimes-drop-16-in-q1-2023-abalos/story/,"Apr 01, 2023"
562,"DOH logs 330 new COVID-19 cases; active tally climbs to 9,021",https://www.gmanetwork.com/news/topstories/nation/865751/doh-logs-330-new-covid-19-cases-active-tally-climbs-to-9-021/story/,"Apr 01, 2023"
563,Civil works contracts for Cavite-Bataan bridge up for bidding this year,https://www.gmanetwork.com/news/topstories/nation/865746/civil-works-contracts-for-cavite-bataan-bridge-up-for-bidding-this-year/story/,"Apr 01, 2023"
564,"LTFRB issues circular extending franchise consolidation deadline for PUJs, UVs, multicabs",https://www.gmanetwork.com/news/topstories/nation/865735/ltfrb-issues-circular-extending-franchise-consolidation-deadline-for-pujs-uvs-multicabs/story/,"Apr 01, 2023"
565,BI to eliminate paper-based departure cards on May 1,https://www.gmanetwork.com/news/topstories/nation/865732/bi-to-eliminate-departure-cards-on-may-1/story/,"Apr 01, 2023"
566,Lawyers group slams conviction of cashier over terror financing sans trial,https://www.gmanetwork.com/news/topstories/nation/865688/lawyers-group-slams-conviction-of-cashier-over-terror-financing-sans-trial/story/,"Mar 31, 2023"
567,DOJ junks murder complaint vs. 17 cops over deaths of Evangelista couple,https://www.gmanetwork.com/news/topstories/nation/865684/doj-junks-murder-complaint-vs-17-cops-over-deaths-of-evangelista-couple/story/,"Mar 31, 2023"
568,"Philippines appeal before ICC still ‘alive’, says SolGen",https://www.gmanetwork.com/news/topstories/nation/865680/philippines-appeal-before-icc-still-alive-says-solgen/story/,"Mar 31, 2023"
569,Marcos to military: Ensure airworthiness of PAF assets,https://www.gmanetwork.com/news/topstories/nation/865677/marcos-to-military-ensure-airworthiness-of-paf-assets/story/,"Mar 31, 2023"
570,Maternal mortality ratio in PH declining — DOH,https://www.gmanetwork.com/news/topstories/nation/865670/maternal-mortality-ratio-in-ph-declining-doh/story/,"Mar 31, 2023"
571,SC declares half-day work on April 5,https://www.gmanetwork.com/news/topstories/nation/865667/sc-declares-half-day-work-on-april-5/story/,"Mar 31, 2023"
572,"Over 77,000 PNP personnel to be deployed for summer holidays",https://www.gmanetwork.com/news/topstories/nation/865665/over-77-000-pnp-personnel-to-be-deployed-for-summer-holidays/story/,"Mar 31, 2023"
573,Castro backs proposal to revert summer vacation to April-May,https://www.gmanetwork.com/news/topstories/nation/865663/castro-backs-proposal-to-revert-summer-vacation-to-april-may/story/,"Mar 31, 2023"
574,NNC reports increased prevalence of obesity among Filipino children,https://www.gmanetwork.com/news/topstories/nation/865656/nnc-reports-increased-prevalence-of-obesity-among-filipino-children/story/,"Mar 31, 2023"
575,Two former DA Region 1 execs get jail time over fertilizer scam,https://www.gmanetwork.com/news/topstories/nation/865645/two-former-da-region-1-execs-get-jail-time-over-fertilizer-scam/story/,"Mar 31, 2023"
576,Padilla files bill recognizing civil effect of church decreed annulment,https://www.gmanetwork.com/news/topstories/nation/865653/padilla-files-bill-recognizing-civil-effect-of-church-decreed-annulment/story/,"Mar 31, 2023"
577,Palace: Gov't work suspended on April 5 from 12 p.m. onwards,https://www.gmanetwork.com/news/topstories/nation/865649/palace-gov-t-work-suspended-on-april-5-beginning-12-p-m-onwards/story/,"Mar 31, 2023"
578,Sen. Imee Marcos calls ICC 'a caricature' of int'l  justice,https://www.gmanetwork.com/news/topstories/nation/865638/sen-imee-marcos-calls-icc-a-caricature-of-int-l-justice/story/,"Mar 31, 2023"
579,Marcos: Rising prices remain biggest problem of Filipinos,https://www.gmanetwork.com/news/topstories/nation/865626/marcos-admin-continues-to-increase-presence-of-kadiwa-stalls-across-ph/story/,"Mar 31, 2023"
580,LTO asked to postpone cap on driving lesson fees,https://www.gmanetwork.com/news/topstories/nation/865618/lto-asked-to-postpone-cap-on-driving-lesson-fees/story/,"Mar 31, 2023"
581,"Robin: If Bato arrested by ICC, ‘isama niyo na ako’",https://www.gmanetwork.com/news/topstories/nation/865574/robin-if-bato-arrested-by-icc-isama-niyo-na-ako/story/,"Mar 30, 2023"
582,"SC junks graft, falsification raps vs. Degamo, 3 others over use of calamity fund",https://www.gmanetwork.com/news/topstories/nation/865572/sc-junks-graft-falsification-raps-vs-degamo-3-others-over-use-of-calamity-fund/story/,"Mar 30, 2023"
583,"237 new COVID-19 cases recorded, active tally hits 8,749",https://www.gmanetwork.com/news/topstories/nation/865566/237-new-covid-19-cases-recorded-active-tally-hits-8-749/story/,"Mar 30, 2023"
584,CHED to discuss with SUCs possible return service for nursing grads,https://www.gmanetwork.com/news/topstories/nation/865559/ched-to-discuss-with-sucs-possible-return-service-for-nursing-grads/story/,"Mar 30, 2023"
585,Bato: Marcos assured me ICC won’t be able to touch a single strand of my hair,https://www.gmanetwork.com/news/topstories/nation/865542/bato-marcos-assured-me-icc-won-t-be-able-to-touch-a-single-strand-of-my-hair/story/,"Mar 30, 2023"
586,"Police chief in BARMM arrested for syndicated estafa, relieved from post",https://www.gmanetwork.com/news/topstories/nation/865539/police-chief-in-barmm-arrested-for-syndicated-estafa-relieved-from-post/story/,"Mar 30, 2023"
587,NTF-ELCAC: Only 136 of 846 farm-to-market road projects completed in 2022,https://www.gmanetwork.com/news/topstories/nation/865536/ntf-elcac-only-136-of-846-farm-to-market-road-projects-completed-in-2022/story/,"Mar 30, 2023"
588,PH 'actively pursuing' adoption of declaration vs. cyber trafficking —DFA chief,https://www.gmanetwork.com/news/topstories/nation/865529/ph-actively-pursuing-adoption-of-declaration-vs-cyber-trafficking-dfa-chief/story/,"Mar 30, 2023"
589,Bersamin to TOYM awardees:  Make PH a land worth living in and loving,https://www.gmanetwork.com/news/topstories/nation/865518/bersamin-to-toym-awardees-make-ph-a-land-worth-living-in-and-loving/story/,"Mar 30, 2023"
590,DOJ says strict departure formalities to protect Filipinos vs. human trafficking,https://www.gmanetwork.com/news/topstories/nation/865515/doj-says-strict-departure-formalities-to-protect-filipinos-vs-human-trafficking/story/,"Mar 30, 2023"
591,"Amid issue with ICC, Marcos says PH to continue bilateral, global engagements",https://www.gmanetwork.com/news/topstories/nation/865511/amid-issue-with-icc-marcos-says-ph-to-continue-bilateral-global-engagements/story/,"Mar 30, 2023"
592,PCG: Over 20 foreign vessels seen around shoals near Palawan,https://www.gmanetwork.com/news/topstories/nation/865498/pcg-over-20-foreign-vessels-seen-around-shoals-near-palawan/story/,"Mar 30, 2023"
593,Marcos tasks CHED to help address shortage of nurses,https://www.gmanetwork.com/news/topstories/nation/865499/marcos-tasks-ched-to-help-address-shortage-of-nurses/story/,"Mar 30, 2023"
594,Henry Teves says he has submitted waiver of confidentiality to DOJ,https://www.gmanetwork.com/news/topstories/nation/865495/henry-teves-says-he-has-submitted-waiver-of-confidentiality-to-doj/story/,"Mar 30, 2023"
595,"Philippines to resume talks with China on joint oil, gas exploration in West PH Sea",https://www.gmanetwork.com/news/topstories/nation/865491/philippines-to-resume-talks-with-china-on-joint-oil-and-gas-exploration-in-the-west-philippine-sea/story/,"Mar 30, 2023"
596,Philippines to be guided by Constitution in joint exploration talks with China,https://www.gmanetwork.com/news/topstories/nation/865476/philippines-to-be-guided-by-constitution-in-joint-exploration-talks-with-china/story/,"Mar 30, 2023"
597,"Philippine vessels drive away China militia boat, say fishers",https://www.gmanetwork.com/news/topstories/nation/865461/philippine-vessels-drive-away-china-militia-boat-say-fishers/story/,"Mar 29, 2023"
598,"Maynilad, Manila Water ask for increase in water allocation from Angat Dam",https://www.gmanetwork.com/news/topstories/nation/865451/maynilad-manila-water-ask-for-increase-in-water-allocation-from-angat-dam/story/,"Mar 29, 2023"
599,"DOH logs 184 new COVID-19 cases; active tally rises to 8,626",https://www.gmanetwork.com/news/topstories/nation/865437/doh-logs-184-new-covid-19-cases-active-tally-rises-to-8-626/story/,"Mar 29, 2023"
600,Bong Revilla recovers from gallbladder surgery,https://www.gmanetwork.com/news/topstories/nation/865428/bong-revilla-recovers-from-gallbladder-surgery/story/,"Mar 29, 2023"
